1025,5,부산광역시 연제구 월드컵대로,글로리모텔 - [부산시지정 모범숙박업소],"글로리 모텔은 한국 관광공사에서 선정한 
굿 스테이(Good Stay)업소로 깨끗하고 조용하며 
최신 시설을 갖추고 있어 출장 손님, 가족단위, 둘만의 휴식처 등으로 널리 사랑 받고 있습니다.

연산동에 위치한 이곳은 시청, 경찰청, 노동청, 구세청 등이 10분 거리에 위치하고 
해운대까지는 약 20분이 소요되는 최적의 교통 조건을 갖춘 곳으로
비즈니스 출장 고객에게 더없이 좋은 곳입니다.

객실마다 준비된 최신 DVD가 구비되어 있어 영화를 볼 수도 있고 
컴퓨터가 설치되어 있어 무료로 인터넷을 이용할 수 있습니다. 

객실은 
로얄실, 비즈니스 온돌실, 비즈니스룸, 스위트실 네 가지 종류이고
비즈니스 룸에는 44인치 벽걸이 TV가, 
스위트 실에는 빔 프로젝트, DVD, 월풀욕조가 준비되어 있습니다. 

그 밖에도 냉장고, 정수기 등의 시설이 마련되어 편안한 휴식공간을 제공합니다. 
",35.18255,129.0809,4.3
1026,3,부산광역시 연제구 월드컵길,종합운동장 실내수영장,"대한민국에서 제일 큰 수영장 규모를 자랑하는 사직종합운동장 실내수영장은 부산 동래구 사직동에 위치해 있습니다.
50M 경영 풀과 연습 풀을 모두 갖추고 있어, 시합을 앞둔 선수와 일반 시민 모두에게 유용하게 이용되고 있습니다.

이 곳에서는 타 수영장에 비해 아주 저렴한 이용요금으로 수영을 즐기실 수 있습니다.
철저한 수질관리로 시민들에게 쾌적한 환경을 제공합니다.
단체 30명 이상 시, 이용요금할인혜택으로 더욱 저렴하게 이용하실 수 있습니다",35.19432,129.0634,4.3
1027,3,부산광역시 연제구 월드컵길,부산종합운동장,"1986년 체조체육관을 시작으로 현대식 실내체육관과 야구장, 종합 실내훈련장, 실내수영장을 준공하여 운영하고 있으며, 특히 2002년 아시아경기대회를 개최하였으며 이후 월드컵 경기장으로도 활용하였다.

21세기 부산의 문화발전과 국제도시로서의 확고한 발판을 구축하기 위한 각종 국제규모 대회유치와 다양한 문화행사 수용하여 시민체육, 보건, 위락등 여가시설을 위한 체육공원으로 조성, 운영되고 있다",35.1933,129.0621,4
1028,6,부산광역시 연제구 온천천남로 ,온천천 산책로(연제구),"온천천(溫泉川)은 일명 동래천(東萊川), 서천(西川), 범어천(梵魚川)이라 부르기도 하는데
부산광역시의 진산인 금정산 고당봉과 이산봉우리 동쪽에 있는 계명봉 골짜기에서 발원하여 범어사, 청룡동 상마전 마을에 모여 수원지를 이루고, 금정구·동래구·연제구를 관류하여 수영강과 합류, 수영구 민락동앞 바다로 흘러드는 지방하천으로서 길이 15.62㎞, 너비 60∼90m, 유역면적 55.97㎢로, 수영강(水營江)의 총 유역면적 가운데 27.7％를 차지한다.

1997년 국가적 외환위기인 IMF를 맞아 실직자가 대량 발생되면서 생계지원책으로 공공근로사업이 시행되자 연제구에서 대규모 공공 근로사업의 일환으로 하천생태복원 및 주민휴식공원으로 조성하여 현재는 1일 13,000여명의 시민이 방문하는 시민공원의 역할을 하고 있다.

여름에는 초등학생이하 어린이들이 무료 물놀이와 자연을 관찰하기 위하여 부모님과 방문하거나 유치원 및 어린이집에서 원생들을 데리고 방문하는 사례가 늘고 있다.",35.18898,129.0916,4.5
1029,6,부산광역시 연제구 연산동 ,황령산 벚꽃길(물만골로),"금정산과 더불어 부산의 대표적인 명산으로 꼽히는 황령산은 연제구와 남구, 수영구, 부산진구에 걸친 부산시의 중심에 있으면서, 금련산맥에서 두 번째로 높은 산이다.
산 정상부는 남미대륙의 안데스산맥의 화산에서 많이 발견되는 안데사이트(andesite), 즉 안산암으로 이루어져 있다.
지리적 위치 때문에 무엇보다도 경치가 좋아서 부산 시민들 사이에서는 오래된 드라이브, 데이트 코스로 알려져 왔다.

1422년, 조선 세종 7년에는 이곳이 군사적으로 중요하다고 여겨 산 정상에 봉수대를 설치했다. 산역이 그리 넓지 않아 3시간 안팎이면 돌아볼 수 있고 체육시설과 야영장이 잘 갖추어져 있다.
산정은 비교적 평탄하며 소규모의 성채 경관을 나타내는 기반암이 노출되어 있고, 북동쪽으로 금련산과 연결되어 있다.
산을 오르는 길은 다양하다. 산역이 넓지 않아 어느 길을 택하든 길을 잃을 염려는 없다.
다만 식수를 구하기가 어려우므로 유의해야 한다.
산 정상에는 통신탑이 있고 부산시내가 한눈에 들어온다. 밤에는 부산 시내의 야경을 감상하러 온 사람들이 많다.
천체 관측을 하기에도 좋아 ‘별 보러’ 가는 즐거움도 덤으로 얻을 수 있다.
황령산 벚꽃길은 2002년 아시아경기대회 개최지 선정을 기념하고 400만 부산시민의 휴식처로 조성하기 위하여 대한전문건설협회 부산광역시회의 식수 헌금으로 1996년 4월 왕벚나무를 심었음. 황령산 벚꽃길은 연제구 연제이마트 맞은편에서 마을버스 연제구1호를 타고 물만골 종점에서 하차하여 황령산 순환도로를 따라 10여분 올라가면 만날 수 있고, 연제구에서 수영구로 황령산 순환도로가 이어져 있어 야간에 승용차를 이용하
여 부산의 야경을 보며 데이터를 즐기기 위해 찾는 시민들이 늘고 있다.",35.18898,129.0916,4.5
1030,1,부산광역시 연제구 연산7동,마하사,"금련산은 연제구에 속하는 산이라고 할 수 있는데, 이 산중에는 범어사에 버금가는 역사를 가진 마하사란 절이 고고한 자태를 뽐내며 자리잡고 있다.

마하사의 마하(Maha)는 산스크리트어로 그 뜻은 ""훌륭한"" ""존귀한"" ""위대한""이란 뜻이다. 결국 마하사란 이름은 글자 그대로 풀이하면 ""훌륭한 사찰""이란 뜻이다. 예로부터 이 마하사가 위치한 지형은 이른바 금학이 알을 품는 금학포란(金鶴包卵)의 형세라고 하여 절 입구에 들어서는 순간 따뜻한 기운이 절로 넘친다고 전해온다.

마하사의 창건 연대에 대해서는 정확한 기록이 없다. 다만 지난 1965년~1970년 대대적인 중창불사를 단행하던 중 대웅전 건물에서 ""상량문"" 이 발견되었는데, 그 상량문에서 마하사를 아도화상(阿道和尙)이 창건했다는 기록이 있었다고 하여 마하사의 창건시기를 신라 내물왕대로 추측할 뿐이라고 한다",35.16374,129.0876,2.5
1031,6,부산광역시 연제구 연산6동,마하사,"금련산은 연제구에 속하는 산이라고 할 수 있는데, 이 산중에는 범어사에 버금가는 역사를 가진 마하사란 절이 고고한 자태를 뽐내며 자리잡고 있다.

마하사의 마하(Maha)는 산스크리트어로 그 뜻은 ""훌륭한"" ""존귀한"" ""위대한""이란 뜻이다. 결국 마하사란 이름은 글자 그대로 풀이하면 ""훌륭한 사찰""이란 뜻이다. 예로부터 이 마하사가 위치한 지형은 이른바 금학이 알을 품는 금학포란(金鶴包卵)의 형세라고 하여 절 입구에 들어서는 순간 따뜻한 기운이 절로 넘친다고 전해온다.

마하사의 창건 연대에 대해서는 정확한 기록이 없다. 다만 지난 1965년~1970년 대대적인 중창불사를 단행하던 중 대웅전 건물에서 ""상량문"" 이 발견되었는데, 그 상량문에서 마하사를 아도화상(阿道和尙)이 창건했다는 기록이 있었다고 하여 마하사의 창건시기를 신라 내물왕대로 추측할 뿐이라고 한다",35.16374,129.0876,2.5
1032,1,"부산광역시 연제구 봉수로 138(연산동, 마하사) ",마하사 응진전 목조석가여래좌상(摩訶寺 應眞殿 木造釋迦如來坐像),"현재 마하사 응진전 전각의 주존불로 모셔져 있으며, 전반적으로 보존 상태가 양호하다. 

본 불상은 얼굴을 약간 숙이고 등을 곧게 편 채 결가부좌한 여래좌상으로, 머리 부분의 크기에 비해 둥글게 쳐진 어깨 부분이 왜소하며 상반신이 비교적 가늘고 긴 편이다. 

양손의 인상(印相 =手印)은 오른손은 무릎 위를 덮은 항마인(降魔印)이고, 왼손은 손바닥을 위로 향하여 무릎 위에 얹은 여원인(與願印)이다. 

상호는 방형에 가까우며, 나발 형태의 머리 부분에 중간계주와 정상 계주가 있다. 머리 부분은 흑칠을 하였고, 발제선과 눈썹, 수염은 녹청으로 처리하였다. 

눈은 비교적 윗 눈꺼풀 선과 아래 눈꺼풀 선 사이의 간격이 뚜렷하게 패여 있으며, 안와선과 콧볼, 입술, 턱주름 선을 음각으로 표현하여 양감을 나타내고 있다. 귀볼은 두터운 편이나 밋밋하게 처리하였다. 

법의는 편삼 위에 대의를 걸친 변형통견식으로 가슴 앞에 U자 모양을 이루며, 벌어진 가슴에는 승각기로 보이는 띠 자락이 수평을 이루며 융기되어 있다. 

발목 위로 흘러내린 군의(裙衣)는 좌우 일정한 간격으로 단을 이루며 가지런히 표현되어 있다. 

불상 뒷면은 법의 자락이 2단으로 목덜미를 감싸고 있으며, 등 부분은 융기된 가슴 부분에 비해 다소 움푹 들어간 상태이며, 머리 부분의 뒷면은 편평하게 처리되었다. 전반적으로 법의의 주름 표현은 매우 두텁게 조각되었다. 

나무로 조각하고 도금 및 채색한 이 불상은 18세기∼조선왕조 말 사이에 제작된 작품으로써, 조선 후기 부산·경남지역의 불교미술 양식과 계보를 살필 수 있는 자료적 가치가 있는 문화재로 평가된다.  ",35.16374,129.0876,2.5
1033,1,부산광역시 연제구 봉수로 138(연산동) 마하사 ,마하사 대웅전 석조석가여래삼존상(摩訶寺 大雄殿 石造釋迦如來三尊像),"본 석가여래삼존상은 현재 마하사 대웅전 내에 유리상자 안에 봉안되어 있으며 전체적으로 보존 상태가 양호하다. 

석가여래상을 중심으로 좌우에 보살상이 1구씩 안치된 석가여래삼존상이다. 

석가여래상은 고개를 약간 숙이고 등을 곧게 편 자세로 양손을 무릎 위에 얹고 결가부좌하고 있다. 

옷은 편삼 위에 대의를 살짝 걸친 변형통견식이며, 양손의 소매 부분이 손목에서 반전되고 있다. 군의(裙衣)는 주름을 잡아 일정한 간격을 이루는 부채꼴로 표현하고 있다. 삼도(三道)는 좁은 간격으로 음각하였고 삼도가 끝나는 지점에서부터 가슴이 볼록하게 융기된 상태이다.

석가여래상의 얼굴은 네모지며, 눈두덩을 볼록하게 표현하였다. 윗 눈꺼풀 선은 먹선으로 일정한 굵기로 선을 그어 나타내고, 백안은 흰색안료를 발랐으며, 작고 오똑한 코는 콧방울을 얕게 파서 표현하였다. 

붉은색을 칠한 입술은 가늘고 작게 표현하였고, 입술 양끝은 살짝 들어가게 처리하였으며, 턱밑에는 1조의 음각선을 새겨 턱주름선을 표현하였다. 나발 형태의 머리 부분은 지발과 육계를 확연하게 구분하지 않고 완만하게 처리하였으며, 정상계주와 중간계주를 두고 있다. 
눈썹과 수염은 녹청을 발라 나타내었다.

협시보살상은 본존의 표현 기법과 거의 유사하다. 단, 보관 아래로 귀를 감싸며 어깨에 흘러내린 긴 머리카락은 검은색으로 칠하고 가장자리 부분에 녹청으로 표현하였다. 

가슴 앞부분의 승각기(하의를 묶은 매듭) 부분은 조선후기 불상조각에서 보편적으로 보이는 몇 겹으로 주름 잡힌 상태로 처리되었다. 

본 석가여래삼존상은 18세기∼조선 말기 사이에 제작된 작품으로써, 보존상태가 양호하여 조선후기 부산·경남지역의 불교조각의 양식과 계보를 살필 수 있는 자료적 가치가 있는 문화재로 평가된다.  
",35.16374,129.0876,2.5
1034,1,부산광역시 연제구 봉수로 138 마하사(범어사성보박물관 위탁보관) ,마하사 영산회상도(摩訶寺 靈山會上圖),"본 작품은 화면 중앙에 석가여래가 연화좌(蓮華坐) 위에 결가부좌하고, 그 전면 좌우측에는 문수보살과 보현보살이 안쪽을 향한 모습으로 연화좌 위에 반가좌하고 있다. 

위쪽으로 사천왕상과 관음보살과 세지보살, 그리고 아난·가섭을 비롯한 제자상이 본존을 에워싸고 있다. 

본존의 신체 부분은 황색을 바르고 머리 부분은 입자가 거친 군청안료를 발랐으며, 윤곽선은 녹청으로 융기되게 표현하였다. 눈썹과 수염 역시 녹청을 그어 약간 솟아오르게 표현하였다. 

입술은 밝은 붉은색을 발랐으며, 상하 입술 사이에는 붉은색을 바르지 않고 여백을 남겨 경계를 짓고 있다. 코는 신체 부분의 선과 같이 표현하고 이중 콧볼을 나타내었다. 가사는 붉은색 바탕에 황백색을 바르고 그 위에 화문을 삽입한 이중 원형 문양을 흩뜨려 장식하고 있다.

본존의 광배(光背)는 녹청 두광(頭光)과 파상문 장식의 신광(身光)으로 구성되어 있고, 붉은색·군청색·백색 등으로 테두리 선을 두르고 있다. 

보살상의 표현 역시 본존과 거의 유사하다. 나한상들과 사천왕상의 안면부는 흰색·분홍색 등으로 표현하고, 신체 선과 주름 선은 붉은색으로 사용하여 주름진 신체의 세부를 입체적으로 표현하였다. 

보살·사천왕의 보관(寶冠)은 일부 금색을 사용하였고, 사천왕의 지물 중 용의 표현은 호분을 두텁게 발라 두드러지게 표현하고 단색으로 처리하였다. 

마하사 영산회상도는 기년명이 뚜렷하여 그 제작 시기를 알 수 있으며, 조선후기 부산·경남지역의 불교미술 양식과 계보를 살필 수 있는 자료적 가치가 있는 문화재로 평가된다.  
",35.16374,129.0876,3
1035,5,부산광역시 연제구 과정로,크로바모텔,"부산시 연제구에 위치한 크로바 모텔은
깨끗하고 아늑한 공간으로 고객의 편안한 휴식을 돕는 모텔이다.
일반실과 특실로 구분되는 객실의 대실료는 2만원, 숙박료는 3만 5천원이고
주말과 공휴일에는 5천원이 더 부가된다.
모던함과 깔끔함이 돋보이는 실내 인테리어와
더불어 무인시스템, PDP TV, PC, 메이크업 세트, 잠옷 등의 편의시설과 용품을 구비하고 있다.",35.18519,129.1065,3.3
1036,5,부산광역시 연제구 과정로,클릭모텔 - [부산시지정 모범숙박업소],"해운대해수욕장, 광안리 해수욕장, 연산동 로타리 동래의 중앙에 위치하며
각각 거리는 10분 정도 소요됩니다.

객실은 일반실, 특실, VIP실이 준비되어 있고
일반실은 4만원, 특실은 5만원, VIP실은 6만원의 요금이 책정되어 있습니다.

주차 시설로는 차량 21대의 수용이 가능한 주차장이 있습니다.",35.18494,129.1066,5
1037,5,부산광역시 연제구 과정로,황토방 모텔 - [부산시지정 모범숙박업소],"비즈니스 전문 업소로 깔끔하고 심플한 모텔입니다.
교육청, 소방본부 등 관공서와 밀접하여 업무용, 출장용 등 비즈니스 업무로
많은 손님이 찾는 곳입니다.
전체 36개의 객실로 객실 내에는 무인 자동화 시스템, PDP TV로 영화관람이
가능하고 100메가급 광케이블, 월풀,홈씨어터(5,1사운드채널), 스팀사우나
DVD, 인터넷, 랜선설치(노트북사용가능) 가 되어 있습니다.

밝은 조명과 인터넷시설이 업무수행을 도와주고 황토방이라 자고나면
개운함을 느끼실 수 있습니다",35.18521,129.1066,3.8
1038,1,부산광역시 연제구 고분로68번길 47(혜원정사),혜원정사팔상도(慧苑精舍八相圖),"팔상도는 석가모니 탄생부터 열반까지의 극적인 장면을 도솔래의상(兜率來儀相), 비람강생상(毘藍降生相), 사문유관상(四門遊觀相), 유성출가상(踰城出家相), 설산수도상(雪山修道相), 수하항마상(樹下降魔相), 녹야전법상(鹿野轉法相), 쌍림열반상(雙林涅槃相) 등 8단계로 나누어 그린 그림으로, 사찰의 팔상전(八相殿), 영산전(靈山殿) 등에 봉안한다.
 조선시대의 전통적인 채색불화를 계승하고 있는 혜원정사 팔상도는 8폭 모두 부분적으로 덧칠한 흔적이 있으며, 제작 당시의 화기(畵記, 불화의 제작연대, 제작자, 시주자 등을 기록한 글) 우측에 후대에 보수하면서 보수시주자 이름을 기술한 화기가 첨부되어 있다. 작품의 상태는 전반적으로 8폭 모두 양호하다.
 혜원정사 팔상도는 조선 후기 팔상도의 전통 도상을 계승하면서 부분적으로 변화를 보이고 있다. 18세기 이후에 제작된 작품으로는 예천 용문사 팔상도(1709년), 순천 송광사 팔상도(1725년), 양산 통도사 팔상도(1775년) 등이 대표적이다. 이 중에서 도솔래의상, 비람강생상의 도상 배치와 구성 인물 등은 통도사 작품과 유사한 점이 많으며, 사문유관상, 유성출가상, 설산수도상, 수하항마상, 녹원전법상, 쌍림열반상의 도상은 송광사 작품과 일치하는 점이 많다. 녹원전법상과 쌍림열반상의 도상은 송광사 및 통도사 작품과 각각 부분적으로 일치하는 점을 볼 때, 혜원정사 팔상도는 18세기 송광사 및 통도사 팔상도 도상과 유사한 계열의 도상작품을 계승하고 있음을 알 수 있다. 
 색채는 밝은 남색, 백록색, 주황색, 어두운 황갈색 사용이 두드러진다. 인물 표현은 먹선 위에 피부색을 흰색으로 칠하였고 윤곽은 암갈색 선으로 처리하였으며, 구름은 주로 적자색(赤紫色), 황색, 녹청색 3가지로 표현하였다. 그리고 공예집기류, 인물의 갑옷, 궁궐 지붕의 치미 등에는 부분적으로 금색을 사용하였다.
 혜원정사 팔상도는 제작 시기가 1925년으로 근대기에 해당하는 작품이지만, 작품의 상태가 양호할 뿐 아니라 근대 한국미술에 대한 재검토와 중요성이 부각되는 흐름 속에서 18세기 팔상도의 전통도상 계승과 변화라는 시점에서 살펴볼 때 의미 있는 작품이라 할 수 있다.",35.184,129.0907,4.3
1039,2,부산광역시 연제구 고분로 ,경주박가국밥,"깔끔한 실내인테리어가 돋보이는 경주박가국밥은 부산에서 가장 맛있는 국밥집 중 한 곳으로 유명하다.

부산 지방의 향토음식으로 꾸준히 사랑 받는 국밥에 싱싱한 야채와 푸짐한 밑반찬을 곁들인 밥상이 기분까지 흐뭇하게 만들어준다. 돼지 뼈를 24시간 이상 고운 뒤 새 뼈로 한번 더 뽀얗게 우려낸 육수는 담백하고 맛깔스러운 국물 맛이 좋다.

국밥과 더불어 왕찹쌀 순대 또한 이 집의 인기메뉴다. 순대 안에는 20여 가지의 재료가 들어가 있어 씹을수록 진하고 감치는 맛이 깊어진다. 주방 경력만 20 년째인 사장님의 넉넉한 인심과 손맛이 음식 곳곳에서 드러난다",35.18437,129.1074,4
1040,7,부산광역시 연제구 거제천로 200,황령산 야경,"빼어난 조망을 자랑하는 황령산은 부산의 야경을 즐기며 걷는 야간산행 코스로 유명하다.

도심 속 건물들의 반짝이는 불빛에 바다 위 광안대교의 늘씬한 조명까지 더해져 부산을 찾는 관광객의 ‘필수 관광코스’로도 여겨진다. 경부고속도로를 빠져나와 해운대 방향으로 가다 KBS부산방송총국을 200m쯤 지나면 왼쪽으로 ‘스노 캐슬’ 오르는 길과 만난다. 황령산 봉수대로 향하는 드라이브 코스가 시작되는 곳이다.

산 중턱에 마련된 전망대에 서면 해운대 등 부산 시내와 주변 바다가 한눈에 담겨진다. 내륙을 휘돌아 거침없이 달려온 불빛이 바다와 부딪치며 화려한 불꽃으로 솟구쳐 오르는 듯하다. 정상을 향해 오르다 KT중계소 앞 언덕에 서면 황령산이 안배한 또 다른 야경이 시작된다. 신선대 부두 등 항구 불빛과 멀리 오륙도 등대불빛이 봄날 아지랑이처럼 깜빡거리며 밤의 서정을 더해준다",35.158837,129.082537,4.5
1041,3,부산광역시 연제구 ,홈플러스아시아드볼링장,"삼성테스코 홈플러스 부산 아시아드점은 멀티플렉스 할인점의 대표적 모델로 꼽힌다. 고객이 쇼핑 뿐만 아니라 스포츠 및 문화생활까지 즐길 수 있는 스포츠 테마형 공간을 자랑한다.

또 이 매장은 또 부산 아시안게임 후 부산시가 할인점 업체를 유치, 유통업체와 지방자치체간의 윈윈 전략을 시도한 곳이다. 홈플러스 아시아드점은 대형할인점 중 국내 최대 규모의 단층 구조 매장(7000여 평)과 2200대 이상 동시 주차할 수 있는 편리한 주차시설을 갖추고 있다.

분기당 평균 3000명이 웃도는 회원을 확보하고 있는 홈플러스 문화센터 등으로 고객 욕구에 적극 부응하고 있으며 이 외에도 부산 최대 규모인 20개 업체가 입점해 있는 유아동 브랜드 의류쇼핑몰, 주부들이 마음 놓고 쇼핑을 하도록 도와주는 어린이 놀이시설, 동보서적 분점 등도 쇼핑 만족도를 높여준다.

홈플러스 아시아드점이 주목 받는 이유는 스포츠 테마형 복합문화 시설을 두루 갖추고 있다는 점이다. 홈플러스 아시아드점은 국내 최대 규모의 무기둥 36레인과 최첨단 운영시스템을 갖춘 볼링장, 실내골프 연습장과 대형 영화관인 프리머스 시네마 아시아드점 등 대형 스포츠·문화시설을 갖추고 있다.

특히 아시아드 볼링장은 국내 최대규모의 시설과 첨단 운영시스템을 갖추고 있어 많은 볼링 마니아들이 찾는 명소이며 국제경기를 비롯해 클럽대항전 등이 활발하게 벌어지는 곳으로 유명하다",35.19164,129.0642,3.5
1042,5,부산광역시 연제구 ,센트럴호텔,"센트럴 호텔은 연산동 로터리와 지하철 16번 출구 인근에 위치한 곳으로
 시청, 법조단지 등이 근처에 있다. 

총 12층 건물의 3층에서 12층까지 호텔이 위치해 있고 
1층과 2층에는 편리한 금융업무를 볼 수 있는 은행이 있다. 
커피숍은 지하 1층, 레스토랑은 3층 로비에 인접해 있다. 

객실은 2인실, 총 2명의 인원 수용이 가능한 트윈 룸, 
총 5명의 인원 수용이 가능한 트윈 룸 특실 세 가지 종류가 있고 
각 객실마다 24시간 케이블 TV가 연결되고 냉난방시설, 세정기가 설치되어 있다. 

객실요금은 각각 4만 5천원, 5만원, 6만원으로 책정되어 있는데 1인당 5천원이 추가된다. 
주차장에는 24시간 주차 관리인이 상주해 있고 총 81대가 주차 가능하다. ",35.18774,129.0815,3.4
1043,5,부산광역시 연제구 ,센트럴호텔,"센트럴 호텔은 연산동 로터리와 지하철 16번 출구 인근에 위치한 곳으로
 시청, 법조단지 등이 근처에 있다. 

총 12층 건물의 3층에서 12층까지 호텔이 위치해 있고 
1층과 2층에는 편리한 금융업무를 볼 수 있는 은행이 있다. 
커피숍은 지하 1층, 레스토랑은 3층 로비에 인접해 있다. 

객실은 2인실, 총 2명의 인원 수용이 가능한 트윈 룸, 
총 5명의 인원 수용이 가능한 트윈 룸 특실 세 가지 종류가 있고 
각 객실마다 24시간 케이블 TV가 연결되고 냉난방시설, 세정기가 설치되어 있다. 

객실요금은 각각 4만 5천원, 5만원, 6만원으로 책정되어 있는데 1인당 5천원이 추가된다. 
주차장에는 24시간 주차 관리인이 상주해 있고 총 81대가 주차 가능하다.",35.18774,129.0815,3.4
1044,2,부산광역시 연제구,가야할매밀면(연산점),"달콤하면서도 새콤하고, 또한 새콤하면서도 구수하고 깊은 밀면의 맛, 밀면의 본고장 부산에서 최고의 밀면을 맛보자.

연제구 연산 5동에 자리하고 있는 13년 전통의 가야할매밀면에서는 당귀, 감초 등 한약재와 소뼈, 돼지뼈를 함께 우려낸  시원한 육수에 밀가루에 전분을 섞어 쫄깃한 면발이 어우러진 밀면을 맛볼 수 있다.

밀면 小 4500원, 大5000원, 비빔밀면小4500원, 大5000원, 사리 1500원,
손만두 1인분 3500원입니다",35.18555,129.0802,3.6
