506,5,부산광역시 중구 중구로,코모도호텔부산,"강렬한 동양적 분위기가 인상적인 부산코모도호텔은 웅장한 풍채로 부산항을 내려다보는 이곳은 바다를 지키는 함대 사령관, 이순신 장군의 이미지를 담고 있다.

부산코모도호텔은 앞이 볼록하고 뒤가 움푹 들어간 특이한 건물 단면이 돋보이는데 배가 부른 쪽의 단면은 마치 파노라마 처럼 많은 투숙객이 부산 앞 바다의 광경을 넓게, 멀리까지 관망할 수 있도록 고안한 단면이고, 단순한 직선단면의 호텔보다 기능적이며 미관상의 아름다움까지 두루 갖추고 있다.

현대적 감각의 최신식 시설과 더불어 내부를 장식한 화려한 단청무늬와 은은한 조명, 각종 한국 민화에서 소재를 본 떠 부조한 벽을 비롯해 연꽃무늬의 천정 및 바닥. 그리고 살아 숨쉬는듯한 용 무늬의 조화가 인상적이다.

코모도호텔의 전 객실은 고객의 취향에 맞는 다양한 형태를 갖추고 있어 폭 넓은 선택의 기회를 받을 수 있다.

전통 건축미와 현대적 감각이 잘 어우러진 객실의 최신 내부 설비. 안락하게 묵으실 수 있도록 모든 편의를 제공하고 있는 이 곳에서 한국의 멋과 편안함을 한껏 느낄 수 있을 것이다",35.10919,129.0353,4
507,5,부산광역시  중구 백산길 20,타워힐호텔,"중구 동광동에 위치한 타워힐호텔은 송도 해수욕장에서 차로 10분, 국제 부두에서 도보로 5분, 자갈치시장에서 7분, 국제시장 도보로 5분, 태종대에서 차로 15분, 용두산 공원 도보로 3분이 걸린다.

객실 종류는 더블과 트윈 객실이 준비되어 있고 요금은 각각 5만원과 5만 5천원으로 책정되어 있다.

총 25대의 차량이 주차 가능한 주차시설과 오락실, 커피숍 및 한식, 양식당 등의 부대시설을 운영한다.",35.10115,129.0343,4
508,5,부산광역시 중구 대청로,엘리제모텔 - [부산시지정 모범숙박업소],"부산의 제일 중심가이며 번화가인 남포동에 위치한 엘리제모텔입니다.
매년 10월이면 전세계에서 가장 역동적인 영화제로 알려진 부산 국제영화제와
""오이소, 보이소, 사이소""를 외치는 정겨운 자갈치 아지매들의 축제! 부산 사람들의
마음의 고향인 자갈치 축제가 펼쳐집니다.

한국 제 1의 항구도시 부산의 제일 중심가이며 번화가인 남포동에 위치한 엘리제는
부산의 명물인 태종대, 철새의 낙원인 을숙도가 차로 20분, 해운대 광안리 해수욕장이
30분, 부산역은 5분, 김해공항은 25분의 거리에 있어서 여행이나 휴가 또는 출장 등의
목적으로 가장 이상적입니다.

30대 차량의 주차가 가능한 주차장이 있으며, 객실 내에는 스팀사우나, 월풀, 광랜 인터넷,
연수기 등 최고의 시설이 구비되어 있습니다",35.101,129.034,4.3
509,2,부산시 부산진구 부전동,서면1번가,"서면1번가는 중앙로(금강제화), 녹색의 거리, 부전복개천까지 80m 구간과 (구)천우장옆 이면도로, (구)마리포사 사거리, LG전자서면 서비스센터까지 십자형 이면도로 420m(폭 8m)에 이르는 구간을 통상적으로 지칭한다. '서면1번가'로 불리게 된 것은 1990년인데, 상가 번영회가 상징성을 부각시키기 위해 이름을 붙인 것이다. 지금은 쥬디스태화를 중심으로 한 거리에 극장과 주점, 카페가 밀집하면서 비교적 상권이 더 발달해 있지만 예전에는 1번가 쪽 거리가 훨씬 유명했다.

극장가를 끼고 있는 쥬디스태화 거리와 함께 화려한 네온사인을 밝힌 주점들과 먹거리 골목을 안고 있는 이곳의 흥겨운 분위기는 절로 발걸음을 가볍게 한다. 길가 레코드점에서 흘러나오는 음악 소리와 오가는 사람들의 활기찬 모습에 동화 되기 때문이다. 젊은 분위기의 카페와 호프집 그리고 값싸고 맛있는 음식점들이 즐비해 있고 언제나 젊은이들의 발 길이 끊이지 않는다. 또한 나이트 클럽과 오락실, 극장 등 여가를 즐길수 있는 위락시설도 많다.

특히 어스름 해가 질 무렵이면 하나, 둘 네온사인이 켜지고 하루 일과를 마친 사람들이 연인과 친구들을 만나기 위해 이곳으로 모여들어 젊음의 열기는 밤이 깊도록 꺼질 줄을 모른다. 몇 해 전부터 서면 1번가 거리에서는 봄과 가을에 특설무대를 만들어 축제를 여는데 젊은 이들이 좋아하는 다양한 공연을 펼쳐 한층 더 젊음의 열기가 넘쳐나는 명소가 되고 있다",35.15492,129.0584,3.4
510,4,부산시 동구 좌천동,좌천동가구거리,"동구의 범일동 간선도로 양쪽의 가구거리는 50년대부터 형성된, 부산시내 가구점의 발상지대라 할 만하다. 2백여개에 가까운 점포가 성업중이며 점포마다 직영공장을 가지고 있는 등 점포 나름의 특징이 있어 고객의 기호를 충족시키고 있다.

70년대 장식용 가구의 등장과 대량 수요증가로 칠기 상가가 생겨 100여개의 업소가 밀집된 명실상부한 우리나라 최대의 가구 상가 지역으로 자리 잡았다.

범일동의 농방(가구)거리와 좌천동의 자개골목은 바늘과 실의 관계라 할 수 있다. 농장을 만드는 농장공예는 범일동에서 일어나고 자개농과 자개장식구에 박을 자개를 갈고 닦는 조각공예는 좌천동에서 번창하여 서로를 돕게 되었다.

자개농, 자개경대, 자개함지, 자개항아리, 자개상자, 자개필통들이 한국의 특산물이 된 데에는 이 좌천동 자개골목이 큰 역할을 하였다.

외국 관광객들은 이 자개가 박힌 소품을 좋아하여 관광상품으로 인기가 많다. 이 자개제품은 범일동의 농방(가구)거리에서만 판매되고 있는 것은 아니고, 전국 방방곡곡으로 판매되고 있어 통영칠기에 견줄만한 부산의 자랑거리이다. 자개의 재료도 국내산이 아니고, 수입품으로 품질과 빛깔이 좋은 넓고 큰 것을 쓰고 있는 것이 특징이다",35.13522,129.0549,1
511,4,부산시 동구 범일동,범일동 귀금속거리,"범일동 지하철역에서 내려 자유시장과 평화시장 방향으로 가다보면 중앙시장에 이르는 이면도로 양쪽에 귀금속만 전문으로 취급하는 곳을 찾을 수 있다. 300m정도의 거리 좌우 양편에 귀금속 전문점이 300여개가 늘어서 있는데 밖에서는 보이지 않는 귀금속 세공공장까지 합하면 400~500곳이 넘는다.

결혼을 앞둔 신혼부부의 예물은 물론 외국의 유명브랜드, 부담 없이 살 수 있는 귀걸이 세트와 돌반지 까지 보석에 관한한 부산 최고의 귀금속 천국이다. 가격도 시중가보다 10~20% 정도 저렴하게 구입할 수 있다. 보통 순금은 10%, 보석류는 30~40%정도 저렴하다. 구형 모델을 신형으로 바꿔주기도 하는데 세공비도 저렴하다.

국내인 뿐 아니라 일본, 러시아 관광객도 많이 찾는 이곳은 ‘부산시 귀금속 특화거리’로 지정돼 해마다 귀금속축제를 열고 있다. 굳이 구입하지 않더라도 눈구경만으로도 흥미로운 곳이다",35.1416,129.0598,4.3
512,4,부산광역시 금정구 ,구서 오시게 시장,"노포동 지하철역 맞은편에 위치한 오시게 시장.

한 때 점포가 400여 개에 이르며 많은 손님들이 찾았던 이곳의 옛 명칭은 구서 종합시장이다. 이곳에는 요즘도 할머니들이 직접 키우고 만든 채소며, 나물이며, 손두부, 쌉싸름한 도토리 묵 등 정겨운 인심과 넉넉한 정을 느껴볼 수 있다.

두 개를 사면 하나를 덤으로 끼워주는 시장상인과 산지에서 갓 올라온 싱싱함, 구서 전철역 인근에 위치해 시장 구경과 더불어 다양한 사람들과의 만남이 기다린다.

재래시장 특유의 정감이 살아 있는 곳. 대형 할인 마트를 벗어나 사람과 사람이 오가는 곳, 만남과 정이 살아 있는 재래시장에서 생활의 활기를 찾아보자",35.28349,129.0949,3.5
513,4,부산 부산진구 범천1동,골드테마거리(범천동 귀금속상가),"귀금속 상가가 밀집해 있는 ‘골드테마거리’ 이다. 범천동에 위치한 이 귀금속 상가 거리는 부산의 대표적인 귀금속 상가이다.

1980년대 초반부터 시내 여러 지역에 퍼져있던 상가들이 자연적으로 범천동에 모여들었다. 단일 상가가 아닌 여러 건물에 점포가 산재 된 재래시장의 형태로 서울 이남에서는 가장 큰 규모이다. 1만 여평의 면적에 귀금속 유통업 263개, 제조가공업 189개 등 총 490여 곳의 상가가 들어서 있다.

특히 다이아몬드 감정부문이 특화 되어 있는데 이 정도의 규모는 서울 종로 귀금속 거리에 이어 국내 두 번째에 해당한다. 부산지역 전체 귀금속 상가의 36%가 밀집되어 있다. 각종 보석 류의 취급과 가공에 있어서 중심적 역할을 하고 있다. 주변에는 백화점과 중앙시장, 평화시장 등 재래 시장들도 가까워 거대한 상권을 형성하고 있다. 매년 10월이 되면 귀금속 상가 거리 축제가 열린다. 귀금속 세일, 경품 행사와 함께 보석,시계류 무료 감별 및 세일 행사가 벌어져 많은 인기를 얻고 있다",35.14234,129.0591,4.3
514,4,부산광역시 중구,국제시장,"국제시장은 부산이 한때 우리 나라에서 가장 거래규모가 큰 상업도시로서 이름을 떨치게 해주었던 상징적인 존재이다. 신창동을 중심으로 하는 국제시장이 모습을 갖추기 시작한 것은 1945년 광복과 함께였다.

광복이 되자 일본인들이 철수하면서 이른바 전시통제물자를 한꺼번에 팔아 돈을 챙기기 시작하면서부터 우리나라 최대시장이었던 부평동 공설시장 일대에 갖가지 물자들이 쏟아져 나왔고 그런 물자들이 드넓은 빈터였던 오늘의 국제시장 자리를 장바닥으로 만들어 자연 발생적으로 상설 시장을 이룩했던 것이 국제시장이 발생하게 된 배경이다.

이 국제시장 장터를 ‘도떼기시장’이라고도 하는데 시장의 규모가 크고 외국물건 등 없는 게 없을 뿐만 아니라 이것저것 가리지 않고 있는 대로 싹 쓸어 모아 물건을 흥정하는 도거리 시장이거나, 도거리로 떼어 흥정한다는 뜻에서 그렇게 불렀다고 한다.

1950년 한국전쟁 이후 피난민들이 장사를 시작하면서 시장으로 형성되었으며 미군이 진주하면서 군용물자와 함께 온갖 상품들이 부산항을 통해 밀수입되었는데 이들 밀수입 상품들은 도떼기시장을 통해 전국 주요시장으로 공급되었다.

국제시장은 밀수 외국상품은 물론 유엔군 군수물자까지 흔하게 거래되었다. 지금은 약 650개 업체에 1,489칸의 점포가 있으며 종사하는 종업원 수는 약 1,200∼1,300명에 이른다. 서울의 남대문 시장과 비슷한 분위기지만 다른 재래시장과는 다르게 식용품, 농수축, 공산품 가게가 미로처럼 얽혀 있다.

1공구는 가방, 문구, 공예품, 2공구는 주방기구, 철기, 안경점, 3공구는 침구류, 양품점, 4공구는 포목, 주단, 양단, 주방기구, 5·6공구는 가전제품, 기계공구, 포목점을 중심으로 이루어진 문방구, 주방기구, 기계공구의 의류, 전기전자류 등이 주종을 이루는 도소매업 시장이다.

인근의 대형 백화점을 비롯한 광복동 상가들과의 상권 경쟁관계에 있으나 여전히 부산 시장의 상징적인 존재일 뿐만 아니라 많은 사람들이 찾는 명소로 꼽힌다.

국제시장이 유행가요인 ‘굳세어라 금순아’에도 등장하는 것처럼 피난민들의 애환이 깃든 시장으로서 한때 우리나라에서 가장 거래규모가 큰 시장으로 성장하였다",35.1007,129.0283,4
515,4,부산광역시 중구,영풍문고 - 광복점,"광복동 롯데백화점 내에 위치하고 있으며 질 높은 서비스와 다양한 문화 상품을 구비하여
방문하시는 분들께 최고의 만족을 드리고  합니다.

쇼핑과 휴식 그리고 지식의 보고를 한번에 경험할 수 있습니다",35.09857,129.0369,4
516,4,부산광역시 사상구,르네시떼,"르네시떼(renecite)는 ‘다시 새롭게 태어난다’는 의미의 르네(rene)와 ‘유통복합체’를 의미하는 시떼(cite)의 합성어로 패션을 리더하는 이미지를 불어로 표현한 말이다.

의류, 잡화, 귀금속, 전자, 컴퓨터, 가구, 식당가에 이르기까지 완벽한 업종구성으로 ‘one stop shopping’의 꿈을 실현하는 곳으로 ‘르네시떼’ 패션의류부터 전자제품, 가구 그리고 패션잡화를 취급하고 있는 유통복합 도소매상가이다.

르네시떼는 2천6백여 개의 매장으로 이루어진 국내 최대규모를 자랑하며 1,200대의 동시 주차가 가능한 초대형 주차장의 효율적인 운영을 위해 첨단주차 시스템을 도입하여 운영하고 각층 매장과 직접 연결되는 시떼관 3층~7층 주차공간확보로 물류와 고객의 이동이 자유롭다.

패션의류, 패션잡화 및 각종 원단, 부자재까지 완벽한 업종 구성으로 ‘one stop shopping’이 가능하도록 매장 구성이 되어 있으며 고객의 입장에서 제2의 비즈니스 공간으로 이용되는 서비스 좋은 은행, 전문식당가, 홈플러스(할인마트), 회계사무소 등 각종 편의시설을 갖추고 있어 편리한 쇼핑의 즐거움을 더해준다",35.16453,128.9778,3.7
517,4,부산광역시 중구,자갈치마켓,"부산 자갈치 시장은 전신만신에 생선이다.

살아 있는 생선, 말린 생선, 포…. 횟집도 많고 곰장어(먹장어)포장마차도 즐비하다(30여개). 수협 공판장에서는 방금 나온 생선을 팔고, 골목엔 횟집과 수산물이 넘친다.

매일 300종이 넘는 어류가 새벽 어스름을 타고 공판장에 도착한다. 특히 자갈치 시장을 대표하는 건물인 자갈치마켓은 남항 바닷가의 새로운 명물이다. 부산을 상징하는 갈매기가 대양을 향해 힘차게 날아오르는 모습이 인상적인 이곳은 현대화된 자갈치 시장으로서 관광객의 편의를 고려한 쾌적한 시설을 자랑한다.

1,2층은 수산물시장과 생선회센터, 3층은 지역수산관련 기업홍보관과 생선회 아카데미회관, 4층은 민속식당, 5층은 오아제 시푸드 부페와 컨벤션센터, 6층은 맥주집과 테마놀이방, 그리고 7층은 스카이라운지로 구성되어 있어 보다 편리한 자갈치 쇼핑에 도움을 준다",35.09685,129.0308,3.8
518,4,부산광역시 부산진구  ,대현프리몰(서면 지하상가),"지하철 1호선과 2호선이 만나는 환승역인 서면은 오래 전부터 부산의 중심상권으로 자리잡아오고 있다.

지하철을 내리면 부전시장과 대현 지하상가 롯데 백화점이 이어지기 때문에 당연히 유동인구가 많고 그 사람들의 발길을 잡기 위해서 많은 상점들이 늘어서 있는데 그 중에서도 여자들을 위한 화장품 가게와 옷집, 구두, 핸드백 가게들이 많다. 상가를 따라 가다 보면 유명 브랜드 가게들도 보이고 상설점도 보이기도 하는데 가게마다 아름다운 옷들이 세련되게 디스플레이 되어 있다.

더구나 얼마 전에 서면지하상가가 오랜 때를 벗기는 전면 리모델링 공사를 통해 전기배선, 공기청정시설은 물론이고 유휴공간까지 새로 말끔히 단장했다. 특히 서면쪽의 분수대는 한쪽의 점포를 없애고 공간을 넓혀 각종 전시나 공연을 할 수 있는 광장형 휴식공간으로 바꾸어 시민들의 휴식과 편의를 겸한 복합문화예술공간으로 거듭나고 있다",35.15485,129.059,4
519,4,부산시 중구 중앙동,부산데파트,"부산데파트는 옛 시청과 전 부산문화방송 건물 맞은 편, 남포동-광복동 입구에 있는 건물로 당시 부산 최초의 현대식 백화점이자 부산상공회의소가 직접 관여해 건립한 준 공영 쇼핑센터였다.

부산최초의 현대식 쇼핑센터로서 그 동안 부산을 알리는 민간 홍보사절의 역할을 톡톡히 해낸 전통공예품과 고미술품 전문시장이다.

참고로 ‘부산데파트’의 ‘데파트는 영어로 ‘Department Store(백화점)의 일본식 표현이다. 부산데파트는 부산국제여객터미널과 인접해 있어 일본인을 중심으로 한 외국인들의 쇼핑 비중이 여느 시장보다 높은 편이다.

1층의 절반 정도 되는 공간에는 10여 개가 넘는 인삼제품 전문점이 밀집해 있어 외국 관광객들에게 단연 인기가 높다. 2층에는 과거의 문인화나 서예작품 등 다양한 고미술품을 전시한 고미술품전문점이 들어서 있어 과거와 현재가 소통하는 공간으로 손색이 없다.

또한 전통공예전문점이 즐비하여 ‘가장 한국적인 것이 세계적’이라는 말을 실감하기에 충분하다. 이 모두가 우리의 역사와 문화를 소개하는 훌륭한 교과서 역할을 담당하고 있는 셈이다",35.09911,129.036,4.5
520,4,부산시 금정구 장전동,부산대학교 쇼핑거리,"부산 최대의 상권 중 하나인 부산대학교 앞 쇼핑거리.

지하철 부산대역에서 대학교까지 이어지는 거리에서는 다양한 아이템의 보세옷과 유명브랜드 할인매장까지 통통 튀는 개성을 만날 수가 있다. 주로 신세대 감각의 의류와 특이한 소품을 테마로 부산의 명물로 떠오르고 있다. 특히 교통의 요충지로 접근성이 용이하고 볼거리, 먹을거리, 입을거리, 문화시설, 쇼핑을 한 곳에서 해결할 수 있는 원스톱 쇼핑이 가능하다.
그리고 뉴욕의 5번가, 일본의 시부야, 이태리의 밀라노 등 세계 유명 쇼핑거리를 재현한 쇼핑몰이 부산대 앞에 등장할 예정이어서 더 많은 관심을 모으고 있다",35.22945,129.0854,4
521,4,부산광역시 북구 ,구포 5일장,"근래 도심 속에서 찾아보기 힘든 대규모 재래시장.

구포시장이 자리한 구포 지역은 낙동강을 따라오다가 만나는 부산의 초입이라 조선중기인 17세기부터 낙동강 줄기의 여러 물산의 집산지 역할을 맡아왔다. 지금도 장날이면 갓 들여온 과일과 야채, 짠 내음 풍기는 각종 생선과 생활용품들을 사고파는 사람들로 북적거리는 옛 시골장터의 모습을 만날 수 있어 구경만으로도 흥겹다.

가장 먼저 구포시장 입구인 쌈지공원에서 시장으로 들어서 만나는 품목은 야채와 과일이다.  활기찬 부산사투리가 오가는 이 골목에는 야채와 과일 뿐 아니라 밥상에 오르는 반찬 재료인 채소, 젓갈, 족발, 어묵, 반찬 등도 판매된다. 야채거리를 지나면 수산물 거리가 나온다. 수산물 거리에는 탱탱하게 살아있는 신선한 수산물과 해산물, 건어물 등이 손님을 맞아 흥정을 돋운다. 특히 부산 강서지역과 진해 등지에서 나는 신선한 회와 민물고기 등이 눈길을 끈다. 수산물 거리에는 다양한 먹거리도 즐길 수 있다.

저렴한 가격을 자랑하는 횟집과 뽀얀 연기를 내뿜는 떡집과 죽집, 그리고 이름만으로도 유명한 구포국수집과 장터국밥집에서 맛보는 요기는 그 푸짐함이나 인심에 한 번 더 배가 부르다. 시장을 한 바퀴 돌고 쌈지공원 입구에서 오른쪽 골목에 있는 약재약초거리에 들르면 20여개의 점포에서 풍기는 진한 약초 향에 마음까지 푸근해진다. 매년 10월 말이면 ‘정이 있는 구포시장 장터 축제’도 열린다. 왁자지껄한 사람들 소리에 사람 사는 냄새와 정이 덤으로 묻어나는 공간, 구포시장은 언제나 열려있다",35.20647,129.0012,3.9
522,4,부산광역시 중구 ,자갈치시장,"부산의 아침을 가장 먼저 기다리고 여는 곳은 자갈치시장이다.

부산 사람들의 아침식단의 찬거리로 올려질 수많은 해산물들이 지난 밤 어둠을 뚫고 육지와 바다의 길을 열고 달려서 모여든 곳에는 어김없이 사람들도 몰려들기 마련이다.

자갈치 시장의 분주함과 자갈치 아지매들의 억센 사투리의 외침,

특히 새벽과 아침의 잇는 공동어시장과 자갈치 시장의 모습이야말로 부산의 아침을 상징하는 것들이다",35.09674,129.0311,3.8
523,4,부산광역시 동래구 ,동래시장,"일제강점기인 1910년 자연 발생적인 5일장 형태로 문을 연 동래시장은 1919년 3.1 독립만세운동의 시발점이 됐던 유서 깊은 시장이다.

1930년 상인들이 목조건물을 세우고 시장의 틀을 잡으면서 부산의 대표적 시장으로 자리잡았다. 그러나 지난 68년 12월22일 원인 모를 화재가 발생해 건물 전체가 불에 타면서 300여 입점 상인들이 하루 아침에 보금자리를 잃기도 했다.
그 뒤 지난 70년 9월 현재의 콘크리트 건물로 다시 태어난 동래시장은 90년 이후 현대식 유통시설에 밀려 간신히 명맥만 유지해 오고 있다.

부산에서 가장 오래된 재래시장의 하나인 동래시장은 현재 대지에 2층 건물, 337개 점포가 입점해 있으며 1층은 농수산물 음식물 생활용품을, 2층은 포목 의류 분식을 주로 판매하고 있다.

최근 대형할인매장 등의 등장으로 퇴색을 면치 못했으나 정부의 재래시장 활성화 대책에 힘입어 건물 리모델링과 고객편의시설 확충이라는 두가 지 목표 아래 상인들도 일정기간 장사를 못하는 불이익을 감수하면서 탈바꿈하고 있다.

향후 냉난방 시설, 휴게실을 비롯한 각종 편의시설, 건물 안전진단 및 보수를 통해 깨끗하고 편리한 시장을 만들어 고객편의는 물론 지역상권 회복을 꾀하고 있다",35.20382,129.0859,4
524,4,부산광역시 중구 ,신동아수산물시장,"자갈치에는 2개의 큰 회센터가 있다.

그중에서도 1987년 준공된 현대식 건물인 신동아 수산물 종합시장(신동아 회 센터)에만 186개 활어 횟집이 입점해 있다.

지하에는 음식센터가 모여있어 자갈치 시장의 신선한 재료에 부산 특유의 맵삭한 양념이 감칠맛 나게 어우러진 양곱창, 꼼장어를 맛볼 수 있다.

1층에는 1백80여 개의 활어, 전복 등 어패류 점포가, 2층에는 70여 개의 각종 건어물가게가 시원한 바닷 바람을 풍기며 손님을 맞고 있다.

3층에는 30여 개의 회센터가 밀집되어 있는데, 1층에서 고기를 직접 골라서 가면 싱싱한 회를 즐길 수 있다. 직접 골라 믿을 수 있고, 저렴한 가격에 신선한 회를 즐길 수 있어 자갈치 시장 1등 관광 코스로 사랑 받는 곳이다",35.09695,129.0292,3.7
525,4,부산광역시 중구 ,남포동건어물도매시장,"자갈치시장 동쪽 끝에 위치한 건어물 도매시장으로 건어물을 전문적으로 취급하는 시장이다. 이곳의 200여개 점포에서 마른멸치, 마른 오징어, 새우,각종 포 등 건어물과 김, 미역, 조개 등 해산물 등을 판매하고 있다. 전국의 중간 도매상들은 물론 일반 소비자들에게도 싼값으로 도소매하는 부산 제일의 건어물시장이다",35.09725,129.0341,4.4
526,4,부산 중구,깡통시장,"이름부터 재미있는 깡통시장, 그 유래를 어디서 부터일까?

6.25후 미군이 진주하면서 군용 물자와 함께 온갖 상품들이 밀수입되었다.

특히 과일, 생선 등 갖가지 통조림이 많이 수입되었는데 이후 시장의 이름이 깡통시장이 되었다고 한다. 또한 ‘돗떼기 시장’이라고도 했는데 그 당시 이곳을 통해 전국의 주요 시장으로 수입 물건들이 공급되었다고 한다.

워낙 시장 규모가 크고 외국 물건 등 없는 물건이 없다고 해서 돗떼기 시장이 국제시장으로 불리게 되었는데, 현재는 다양하고 많은 제품의 수입이 허가되면서 시장이 다소 위축되기는 했지만 아직도 그 명성과 저력은 여전히 느낄 수 있는 명소이다.

초창기 미군부대에서 흘러나온 통조림 등 깡통제품을 많이 판매한 데서 붙여진 이름이지만 지금은 양주 의류 장식품 액세서리 패션 잡화와 미니카세트 등 일부 외제 전자제품도 취급하고 있다.

부평시장 내 깡통시장에 점포를 갖고 있거나 영업을 했던 상인들의 90%이상으로 구성된 월드밸리는 백화점에 없는 다양한 품목을 갖추고 있다.

보는 재미, 사는 재미가 있는 깡통시장에서 색다른 쇼핑의 묘미를 즐겨보자",35.10089,129.0274,4
