1,2,부산시 동래구 ,동래시장 곰장어거리,"수안동 새마을금고 앞 노폭 6m 도로 양쪽에 형성되어 있는 곰장어거리는 1986년에 첫 곰장어 식당이 개업하고 난 뒤 그 이듬해부터 하나 둘 들어서기 시작하여 2002년에는 12개 업소로 번창하여 왔다.

곰장어거리 주변은 재래시장인 동래시장, 수안인정시장을 비롯하여  돼지국밥집, 통닭집, 각종 유흥주점 등 상권이 잘 형성되어 있어 많은 시민들이 왕래하고 있는 지역이다",35.20377,129.086,3.6
2,1,부산시 금정구 노포동,금정산 범어3기,"‘범어(梵魚)3기(三妓)’란 범어사와 관련된 흥미로운 옛 이야기 세 가지를 일컫는 말이다.
범어 3기에는 ‘원효석대(元曉石臺)와 ‘자웅석계(雌雄石階)’ 그리고 ‘암상금정(岩上金井)’이 있다. ‘원효석대’는 원효암 뒤에 있는 암석으로 매우 기묘하고 아름다운 형태를 띄고 있다.

이곳은 원효 대사가 좌선을 했던 곳으로 지금도 신성시 되고 있다. 원효석대에는 지금도 불상을 모셔놓고 신성한 곳이라고 하여 함부로 출입을 못하도록 원효암에서 통제하고 있다. ‘자웅석계’는 계명암에 자리잡은 암탉과 수탉의 모양의 암석으로 지금은 수탉 형상만 남아 있다. ‘암상금정’은 금빛을 내는 우물인 금정산 고당봉 꼭대기의 금샘을 일컫는데 범어사 창건 전설과 금정산이라는 이름이 유래된 것으로 유명하다",35.27811,129.0568,3.4
3,1,부산시 서구 서대신동,구덕산,"서구의 서대신동과 북구의 학장동, 사하구 당리동 까지 이어진 부산시의 대표적인 산이다. 해발 562m.
태백산맥의 말단 금정산 줄기 끝 자락에 위치해 북동쪽으로는 엄광산, 남서쪽으로는 시약산에 이어져있다.

기록에 따르면 19세기 말에는 병풍처럼 둘러져 있다 하여 사병산이라는 이름으로 불렸다고 한다.
전형적인 노년산지의 모습을 띄고 있으며, 짙은 산림과 깊은 계곡이 발달해 있다.

울창한 수림을 자랑하는 구덕산은 시민들의 등산코스로 각광 받고 있다. 부산 최초의 급수원인 구덕 수원지가 동쪽 산록에 위치하고 있으며, 구덕산 기슭에는 구덕골청소년수련원이 지어져 지역주민과 청소년들의 문화 요람의 장으로 애용되고 있다.

이 외에도 휴식공간인 대신공원과 한 때 대규모 꽃 재배단지로 유명했던 꽃마을도 이 곳 구덕산에 있다",35.12348,128.9923,4
4,1,부산시 금정구 청룡동,범어사 미륵전-불상이야기,"미륵전은 종루 앞, 대웅전의 오른쪽에 자리잡은 앞면 3칸, 옆면 2칸의 아담한 맞배지붕 건물이다.

안에는 목조 미륵불좌상을 독존으로 봉안하였다. 본래 임진왜란 이전에는 미륵전에 4위의 미륵불이 봉안되어 있었다. 서남북쪽의 3위는 석조였고, 동쪽의 1위만 목조였다. 석조 미륵은 모두 없어졌으나 목조 미륵불은 지금까지 남아있다. 이 미륵불은 특이하게 정면, 곧 입구의 문을 바라보는 것이 아니라 오른쪽 벽을 등지고 대웅전을 향해 앉아 있다.

이는 서쪽을 등지고 동쪽을 바라보는 형상이다. 임진왜란을 맞아 미륵전이 전소되는 불행을 겪었고, 이 때문에 일본을 등지고 있다.",35.28368,129.0688,4.5
5,1,부산시 금정구 청룡동,범어사 비로전 목조비로자나삼존불상,"부산광역시 금정구 청룡동범어사비로전에 있는 목조 비로자나삼존불좌상이다. 비로자나부처님은 
법신불(法身佛)이다. 비로자나부처님을 청정법신(淸淨佛身)이라고 한다.
영혼이 맑고 아름다운 사람은 법신에서 법향이 난다. 비로전 법당은 조선 숙종9년(1683) 해민스님
이 중창하였다. 나무로 조성한 비로자나삼존불좌상의 좌우에 있는 불상은 문수보살과 보현보살이
다. 범어사 비로전에 봉안되어 있는 본 목조비로자나삼존불좌상은 방형의 수미단 위의 연화좌에 
각각 결가부좌한 자세로 앉아 있다. 중앙 본존울은 125m,좌우협시 100cm정도의 크기로, 중앙의 
본존불이 협시불에 비해 규모가 크게 조성되었다. 본존불은 등을 세우고 얼굴을 앞으로 약산 숙여 
아래를 굽어보고 있으며, 수인은 지원인이다. 보편적인 조선후기 불상과 마찬가지로 신체에 비해 
머리가 큰 편이다. 좌우 협시보살은 본존불에 비해 규모가 작고 보살로서의 형식적인 차이가 
있을 뿐 자세나 신체의 비례, 전체적인 얼굴 표현 및 기법, 인상 들은 본존불과 거의 유사하다. 
이 삼존불은 비교적 규모가 큰 불상으로 신체 비례는 관음전 목조관음상과 차이가 있으나, 안면과 
머리부분의 표현은 매우 흡사하다. 범어사에 전해오는 비로자나삼존불의 중수도금기(重修途金記)에 
의하면, 이 불상은 1638년 해민(海敏)스님이 비로전을 중창할 당시에 조성되었으며, 이후 1722년
의 중수도금 작업에 관음전 불상을 제작한 진열(進悅)외에 청우(淸雨), 청휘(淸徽), 관성(貫性), 
옥홀(玉惚)등이 관여하였다고 한다. 범어사지(梵魚寺誌), 범어사 관음전 대좌묵서명 및 중수도금
기 등에 기록된 비로전 불상의 중수와 조각승에 대한 기록이 동일 한 것을 보면 중수도금기의 
내용은 확실한 것이라고 판단된다. 본 작품은 관음전 목조불상과 함께 조각승 진열의 작품 연구에 
중요한 가치를 지니고 있으며, 보존상태가 양호할 뿐 아니라 작풍도 뛰어난 문화재이다.",35.28379,129.0684,4.5
6,1,부산시 수영구 민락동,옥련선원,"옥련선원은 백산의 남쪽 기슭, 양지 바른곳에 자리잡고 있습니다.

서기 670년(문무왕 10년) 원효대사가 백산사로 창건하여 서기 910년(성덕왕 9년)에 고운 최치원 선생이 백산사에서 은둔 참선한 유서깊은 고찰로 1604년 1월1일 재건되었습니다.
1635년(인조13년) 해운선사가 옥련암으로 개칭하였으며, 1976년 대웅전을 중창하면서 옥련선원으로 개칭하여 현재에 이르고 있습니다.

1998년 10월 17일 전통사찰 제28호로 지정된 옥련선원은 부산시 문화재자료 제7호인 '마애지장보살좌상'을 비롯하여 미륵대불, 부석불석상 등이 있습니다.",35.1626,129.1255,5
7,1,부산시 수영구 망미동,영주암,"1850년 자그마한 수도체로 창건 당시는 토굴로서 토곡절이라 하였으나 주변경관이 수려하고 중국설화의 신선이 머무르며 수행한다는 삼신산 중 영주산의 모습과 비슷하다하여 1940년 3월 15일 재창건되면서 영주암으로 개칭하였습니다.

이곳은 식수와 법당에서 바라보는 전망이 좋아 모든이의 마음을 넓고 확 트이게 하며 멀리 보이는 잔잔한 바다물결이 우리의 마음을 안정되게 해주어 항상 맑은 기운이 감도는 수행과 정진도량입니다.

현재의 대웅전은 1975년 원통보전은 2002년에 중창하였습니다. 1988년 12월 5일 전통 사찰 제8호로 지정되었습니다.",35.17639,129.0988,3.7
8,1,부산시 금정구 청룡동,범어사 지장전,"대웅전 서쪽에는 1990년에 새로 건립한 지장전이 있다.

절에는 본래 1657년(효종 8)에 최 씨 성을 가진 신도가 시주한 명부전이 있었다. 당시의 자리는 팔상전 앞. 지금의 서지전 자리였다. 그 뒤 1891년(고종 28)에 양화 대사가 중수하였으나 1988년 불의의 화재를 만나 소실되고 말았다. 당시 지장전 안에는 조선시대 후기에 조성한 목조 시왕상이 있었는데, 매우 빼어난 조각이어서 절로 환희심이 날 정도였다. 그러나 아쉽게도 모두 화마에 사라졌다. 1990년에 대웅전 옆에 있던 탑을 일주문 옆 탑전으로 옮기고 지금의 자리에 지장전을 신축하였다.

크기는 앞면과 옆면 각 3칸의 겹처마 맞배지붕이다. 새로 신축하면서 대웅전의 양식을 본떠 다포식이면서도 맞배지붕을 올리고 측면에는 풍파능을 달았다. 안에는 지장보살을 중심으로 그 좌우에 도명존자와 무독귀왕, 그리고 시왕상을 봉안하였고 문 입구에는 금강역사가 있다",35.28151,129.0794,4.5
9,1,부산시 금정구 청룡동,범어사 종각,"보제루 북쪽에는 종루가 있다.

아침저녁에 거행하는 예불이나 의식에 사용하는 사물, 곧 범종, 법고, 운판, 목어를 봉안한 2층 누각 건물이다. 이 종루가 언제부터 있었는지는 알 수 없으나 1669년(숙종25년) 명학 스님이 중창하였다는 기록이 전한다. 그러나 당시의 종루는 지금의 위치가 아니라 삼층석탑 맞은편이었다.

1910년대에 현재의 자리로 옮겼다. 구조는 2층의 누각에 앞면과 옆면 각 3칸의 규모로 겹 처마의 팔작지붕이다. 전에는 1층이 개방된 공간이었으나 지금은 기둥 사이를 막아 문을 가설하여 기념품 판매점으로 사용하고 있다",35.28406,129.0686,4.5
10,1,부산광역시 금정구 청룡동,범어사 성보박물관-유물전시관,"조계종 제 14교구본사 범어사 성보박물관은 108여평의 전시실과 50여평의 수장고 및 학예실을 갖추고 있으며 지상 1층 지하 1층 규모이다. 지난 99년 공사를 시작하여 2000년 12월 건물을 완공하였으며 2003년 3월 26일 개관하였다. 박물관이 소장하는 유물은 조선후기 불화를 비롯하여 50여점의 진영, 1000여종의 전적과 14종의 목판.23종의 현판을 비롯해 각종 불기와 유물 등이다.

전시실은 범어사 역사, 주제전시, 불교문화, 동산스님, 기획전시의 다섯 부분으로 나누어져 있다. 범어사 역사실은 범어사 창건사적을 기록한 목판과 의상스님 영정, 범어사 중수기록 등 각종 명문이 새겨진 기와 등이 전시되어 있으며, 주제 전시실에는 보물 제419-3호 삼국유사와 함허어록, 지공직지, 천수 책판, 어산집 책판 등 다양한 불서와 책판들을 전시하였다.

불교문화실은 범어사가 왕실의 원찰임을 알려주는 현판과 병풍, 왕실의 만수무강을 기원하기 위해 불단에 봉인했던 원패를 비롯하여 사찰에서 불교의식을 행한 뒤에 발원문을 넣어두기 위해 불단 좌우에 안치했던 높이 1.3m에 달하는 옴마니반매훔소통 등 여러 법구들을 전시하고 있고, 동산스님실은 오랫동안 범어사에 주석(主席)하며 한국 선불교의 발전에 크게 기여하신 동산스님의 영정과 유물을 전시하여 대선사에 대한 존모의 마음을 표시하였다.

그리고 기획전시실은 국가에 공을 세웠거나 조선불교의 중흥에 힘쓴 스님들과 범어사에 주석하신 스님들의 진영을 전시하였다.박물관에 전시된 유물 가운데 대표적인 전시품은 삼국유사와 사천왕도, 백의관음도, 의상대사 진영 등을 들 수 있다",35.28406,129.0686,3
11,1,부산시 강서구 지사동,명월사지흥국사,"부산 강서구 지사동 명동(明洞현)마을 산 498번지에 흥국사가 있다.
이 흥국사 자리를 명월사(明月寺) 옛터라 한다.

현재의 흥국사는 1956년 중건하였다. 경내에는 「가락국태조왕영후유허비(駕洛國太祖王迎后遺墟碑)」가 세워져 있다.
오늘날의 흥국사의 주변일대가 옛날의 명월사지(明月寺址)였다고 하나 지금은 옛 자취를 찾아볼 수 없다.

그러나 흥국사의 칠성각을 건립할 때 출토된 화강암제의 석탑면석(石塔面石) 1개와 다른 석제품조각 1점이 보관되어 있다.
그 석탑면석을 명월사 사왕석(蛇王石)이라 일컫고 있다.

1983년 1월 이곳에서 금동여래입상(金銅如來立像) 1구가 출토되어 현재 국립중앙박물관에 보관되어 있다",35.13452,128.8302,5
12,1,부산광역시 금정구 청룡동,범어사 불이문,"불이문은 제3문으로서 절에 이르는 마지막 문이다.

불이(不二) 그 자체는 진리를 나타내는 생과 사도 둘이 아니고 하나라고 하는 진리는 둘이 아니고 하나라고 하는 불문 중 에서도 유마거사의 불이법문이 등장하듯이 일체에 두루 평등한 불교의 진리가 불이문을 통하여 재조명되는 뜻이 있으므로 오직 아문을 통하여 불교의 진리가 전개 되는 것이다.

불이문 역시 전면3간의 맞배지붕 으로서 말쑥한 모습이 숲 속에서 더욱 운치가 있어 보인다. 단조로우면서도 어딘지 모르게 복잡하게 연결방식을 하고 있는 이문은 범어사로 통하는 마지막 문이다.

이문을 통과 함으로써 명실공히 사파를 떠나 정토애로 통하는 길이 열리는 것이다",35.28406,129.0686,4.5
13,1,부산광역시 금정구 청룡동,범어사 보제루-목우도,"범어사의 三門을통과하면 보제루가 바로 눈앞에 와 닿는다.

높은 석탑 위에서 그 위용을 드러낸 이 건물은 약 6~7미터 높이의 벽 석계(石階)를 올라가야 한다. 다른 사찰 구조와 달리 누각 밑을 통과 하게 되는 이름 그대로 누각이 아니고 정면에 석계를 배치 한 것이 범어사 만의 특징이다.

이 건물을 보제루라고 하는 것은 삼계에 투망을 놓아 인전의 고기를 건진다는 뜻이 숨어 있다. 보제루는 전면5간 측면3간의 8작지붕이다 대웅전아래 넓은 마당에 위치해 있고 현재 사찰 내에서 가장 큰 건물로 모든 법회 의식 등이 이 건물을 중심으로 하여 진행된다.

그리고 보제루 북쪽에는 사방 3간의 종루가 있다 대범종과 대북 목어 운판등의 불교의식용구가 진열되여 있는 건물이다.  2층의 누각건물로서 지붕은 8작을 나타내고 있다.

범어사의 목우도는 보제루 외벽에 그려져 있는데 쌍민으로 끝을 내고 있어 확암본 보다는 보명본의 분류를 따르고 있다. 보명 선사의 목우도는 검은소가 조련되어 하얀 소가 되는 과정을 그린다.

※ 보제루 해체 보수 후 현재 단청공사(2012년 6월 ~ 2013년 8월) 시행 중으로 공사완료 후 업데이트 됩니다",35.28368,129.0688,4.5
14,1,부산광역시 금정구 청룡동,범어사 나한전,"나한전은 부처님의 제자들을 모신 곳으로 석가모니불의 직제자 가운데 정법을 지키기로 맹세한 16나한을 모시는 곳이다.

나한은 부처가 되지는 못했지만 이미 해탈의 경지에 도달한 성자이므로 초자연적인 신통력과 더불어 독특한 표정과 자유스러운 자세를 갖고 있다.
나한전에는 창살 장식에 공을 들였다. 각각 좌우 칸은 이분합 빗살문, 어칸은 삼분합 빗살문을 달았는데 가운데만은 변형된 빗살문으로 모양을 냈다",35.28406,129.0686,4.5
15,1,부산광역시 금정구 청룡동,범어사 금어선원,"금정산의 차분한 공기가 감도는 산의 중턱에 자리한 선원은 1968년에 완공되어 오늘에 이른다 .전면6간 측면3간의 8작지붕 으로서 금어선원(金魚禪院)이라 이름했다.

본래 이곳의 선원은 현재 선원의 건물 앞 족에 있던 청풍당이 선원으로 사용되었으나 이를 철거하고 현재의 건물을 세웠다고 한다.
그러나 1986년에 범어사 주지를 역임했던 서해 흥교 대화상님게서 극락암을 헐고 그 자리에 새로운 청풍당 선원인 한번 입실하면 평생 두문불출 나오지 않는 규칙의 평생 수도원셈인 청풍당을 새로이 변모시킨 유일한 보사에 생겨진 평생 수도원이 생겨진 것이다.
선원 큰방 앞면 6칸, 측면 3칸의 팔작지붕으로 수용인원은 25명 선 이다.

이곳은 경허, 성월일전, 영명혜일, 도봉본연 스님 등이 가부좌를 틀고 정진했던 명안종사의 산실이며 한국 선종의 심장부였다",35.28406,129.0686,4.5
16,1,부산시 남구 용당동,동명불원,"용당동 용비산(龍飛山)에 자리잡고 있는 동명불원(東明佛院)은 동명목재 회장 고 강석진 씨가 국가번영과 부모의 왕생극락을 빌고 동명의 산업현장에서 일하는 1만여명의 동명 가 족들의 행운을 위해 건립했다.

대웅전 내부에는 석가세존을 중심으로 좌편에 미륵보살, 우편에 제화 갈라보살 등 3본을 모셨고, 좌불은 우리나라에서 제일 큰 16m이며 법당의 크기도 150.9평이나 된다.

법당의 가운데에는 기둥없는 특수 공법을 사용했고 내부 천장의 중앙에 4마리의 용머리를 조화시 켰으며 양쪽 벽에는 비천상을 새겼다. 극락전 나한전 관음전이 갖추어져 있었고, 칠성각 산신각 독성각은 2층으로 설계하고 2층에는 불교서적을 진열했다.

사천왕문의 설계는 입상으로 하였고 효자 효부를 기리기 위해 만든 덕성탑 남자의 덕망과 여자의 덕성을 상징하며 모든 선남선녀는 불법에 귀의하여 덕망과 부덕을 잘 닦아야 한다 는 뜻을 담은 부덕탑이 있다.

산신각의 산신은 불원이 자리잡은 산령님을 정중히 모셨다. 동명불원으로 들어가는 입구에는 대관문이 있고 주변에는 인공으로 된 바위만한 정원석을 쌓아 사찰의 위용을 돋보이게 했다. 트럭 1대에 정원석 1개를 싣고 올 정도로 큰 돌들 뿐 이다[동명불원 사천왕문] 동명불원에는 법구사물 중 하나이며 세계최대의 법종인 동명불종이 있는데 무게가 27톤으 로 경주 에밀레종보다 6톤이나 무겁다.

종의 사방면의 모양은 연화좌 위에 무릎을 세우고 공양하는 공양상과 비천상 주위에 보상화를 구름과 같이 피어오르게 한 것으로 되어 있고 천상으로 천의와 영락등이 휘날리고 있는 에밀레종(국보29호)의 비천상과 구름 위에 서서 서로 마주보며 무릎을 세우고 하늘을 날며 공후와 생을 주악하는 강원도 상원사종(국보36 호) 비천상의 두 모습을 참고하였다.

문양에 있어서도 장식문형과 비천상, 여래상, 보살상, 동자상 등 상징적인 조상이 있으나 이 불종은 비천상의 문양을 택하였다. 무거운 거종을 메어 단 들보에는 관세음보살 육자 대명왕 진언 옴마니반 메홈의 범자가 씌어 있다.

박달나무의 종채는 네 가닥의 쇠사슬로 매어져 있고, 좌우 양편에서 두 사람이 치도록 되어있다.

종의 북쪽면은 동명불종이라는 이름을 새겼고, 남쪽면은 서기 2520년 4 월 8일 단 기 4309년 4월 8일로 조성시기를 밝혀 놓았다",35.11895,129.1032,4.3
17,1,부산시 영도구 함지로 ,영도문화예술회관,"복합문화공원 조성사업은 2004년도부터 2009년까지 290억원이 투자되는 영도구 개청이래 단위사업으로서는 건립규모가 가장 큰 대형 프로젝트로서 문예회관, 도서관, 체육센터가 건립됩니다.

그동안 지역적 여건으로 각종 문화적 복지혜택에서 소외되었던 지역주민의 문화 복지 수준향상을 위하여 각종 문예 활동 공간, 도서관, 국민생활 체육시설 등을 비롯한 레저스포츠 공간 등을 복합적으로 조성하여 구민들에게 지역문화를 창조하고 누릴 수 있는 거점을 제공함으로서 삶의 질 향상은 물론 타 지역과 문화향유 및 불균형 해소를 통하여 21세기 문화선진도시로서의 경쟁력 확보와 우리구의 위상을 드높이게 될 것입니다.

앞으로 복합문화공원이 아름다운 환경 속 에서 사계절 구민 곁에 머무는 아름다운 삶의 공간으로 조성 될 수 있도록 최선의 노력을 다하겠지만 여러분께서도 깊은 애정과 많은 관심을 가져주시고 다양한 의견을 보내주시면 적극 반영토록 하겠습니다.


*주요시설 : 지하 2층, 지상 3층, 대공연장(428석),소공연장(183석), 야외공연장, 연습실 등
*층별시설
- 지하 2층 : 공조실
- 지하 1층 : 소공연장,출연자대기실,전시실,매표
- 지상 1층 : 출연자대기실,분장실,매표
- 지상 2층 : 대공연장,영사실,무대제어실,통신실
- 지상 3층 : 연습실,측면투광",35.07493,129.0655,4
18,6,부산시 서구 토성동 4가,서구청 소공원,"시내 한복판. 아름다운 도심속의 휴식공간이 있다.

옛 충무초등학교 자리. 소공원 한가운데 있는 고목 느티나무 한 그루가
오랜 세월의 흔적을 말해주는 듯 하다.

그 나무는 지금 새 식구들을 맞아 조화롭게 아름다운 정원을 이루고 있다.
2003년 1월 구청이 대신동에서 옮겨오면서 조성된 소공원으로 많은 구민이
이용하는 곳이다.

만남의 광장이자 구민들의 휴식과 운동장으로 많이 애용되고 있다.

푸른 녹음 아래에선 각종 전시회와 작은 음악회가 열리고, 구민합동결혼식도 열린다.
사계절 꽃이 있고 새들의 지저귐이 있는 도심의 숲속에는 언제나 만남과 휴식이 있고 구민들의 이야기로 가득하다",35.09789,129.0239,4.5
19,6,부산시 해운대구 송정동,해마루,"해운대 달맞이 언덕에서 송정으로 가는 끝자락에 위치한 해마루.

2005 APEC이 부산 해운대에서 성공적으로 열린 것을 기념하기 위해 올 초 해운대구에서 만든 전망대이다.
달맞이 고개에 고개를 내밀어 청사포와 송정을 양 어깨로 감싸 안은 가슴 넓은 아버지의 모습이다. 9평의 아담한 전통 팔각정자로 기둥의 중심이 굵고, 위아래가 가늘게 된 배흘림기둥과 계자난간, 우물마루를 갖추고 있다.

풍수지리학적으로는 장산을 중심으로 동백섬이 ‘우백호’ 라면 해마루는 ‘좌청룡’ 자리라 한다. 북쪽으로는 장산이 보인다. 대한팔경의 하나인 청사포에 자리해 있어서, 바다의 신비로운 모습을 한 눈에 볼 수 있고, 일출과 월출을 한꺼번에 맞이할 수 있다",35.16462,129.1913,4.2
20,6,부산시 기장군 기장읍 대변리,토암도자기공원,"자연과 벗삼아 흙읅 만지고, 그 흙으로 도자기를 굽고, 야외 전시장에서의 그림 감상도 할 수 있는 산속의 작은 문화공간이자 편안한 쉼터. 작고 아늑한 대변항 바로 위, 토암 서타원 선생이 마련한 숲 속의 문화쉼터 토암도자기공원이다.

공원에 들어서면 펑퍼짐한 얼굴형에 찢어진 눈, 납작한 코, 결코 미남 미녀의 얼굴은 아니지만 하나같이 합창하듯 방긋방긋 웃는 2천여 개의 토우들이 정감 어린 모습으로 방문객을 맞아준다. 이 아이들은 서타원 선생이 2002년 월드컵을 기념하여 만든 작품들이다.

이곳에서는 30년간 흙을 주무르며 살아온 서타원 선생의 지도를 받아가며 도자기를 직접 만들어볼 수 있다. 도자기를 빚는 데 걸리는 시간은 대략 2시간 정도. 방문객이 원할 때 언제든지 만들어볼 수 있지만 ‘수강생’이 다섯 명 이상은 되어야 한다.

만드는 비용은 1인당 1만원이고 도자기를 빚은 후 20일 후에(도자기가 어느 정도 모아져야 가마에 불을 지필 수 있기 때문) 자신의 작품을 가져갈 수 있다. (지역이 멀어 도자기를 가지러 오기 힘들 경우 택배로 신청하면 된다)

아울러 이곳에서는 비정기적이지만 한 달에 한번씩 숲 속에서 열리는 이색적인 음악회도 만날 수 있다. 음악회가 열리면 노란 불빛의 은은한 가로등이 낭만적인 분위기를 연출하고 그 아래 잔디밭은 편안한 좌석이자 무대가 되어 잊지 못할 추억을 선사한다",35.22902,129.225,3.7
21,6,부산시 강서구 대저1동 ,강서문화원,"강서문화원에서는 우리지역의 역사 등 다양하고 유익한 문화정보를 제공하기 위해 설립되었고
민요반, 풍물반, 사진반, 도예반등 10개반의 문화학교를 운영하여 구민의 문화욕구를 충족하기 위해 최선을 다하고 있다.

또한 향토자료 수집, 강서문화 책자 발간, 문화유적지 탐방등 각종 문화사업을 펼치고 있다",35.21329,128.98,5
22,2,부산시 동래구 ,온천장 곰장어 골목,"2005년 11월에 만들어진 온천노천족탕에서 허심청 주변으로 형성되어 있는 곰장어 골목은 2005년에 차 한대가 겨우 지나다닐 수 있는 좁은 골목길로 포장마차가 성업 중이었으나,
이제는 8미터 도로로 확장되면서 깨끗이 정비되어 노천족탕을 체험하고 단백질이 풍부한 최고급 스테미너 음식인 곰장어를 먹을 수 있다.

뜨거운 불에서 갓 구워낸 곰장어는 자근자근 씹히는 맛이 쫄깃쫄깃하고 구수해 소주안주로 사랑을 받고 있으면서 웰빙 식단으로도 인기가 있는 식품이",35.2205,129.0814,3.4
