1544,1,부산광역시 금정구 범어사로 250(범어사),범어사 대웅전 삼장보살도 (梵魚寺 大雄殿 三藏菩薩圖),"범어사 대웅전 내부 좌측 벽면에 걸려 있는 삼장보살도는 역시 범어사 대웅전에 모셔져 있는 석가영산회상도 및 제석신중도와 함께 1882년에 제작되었다.
 크게 상？하단으로 나누어 진 화면의 윗부분에는 가운데 천장보살(天藏菩薩)을 중심으로 좌우에 각각 앉아있는 모습의 지지보살(持地菩薩)과 지장보살(地藏菩薩)을 배치한 삼장보살이 중심을 이루고 있고, 그 주위로 천부중(天部衆)들이 배치되어 있다. 
 하단부는 새 깃털 장식 투구를 쓴 동진보살(童眞菩薩)과 악기를 연주하는 천녀(天女)들의 무리를 중심으로 좌우에 신장(神將) 무리들이 3단으로 열을 지어 질서정연하게 묘사되어 있다. 화면에는 모두 79위의 도상을 묘사하고 있다. 
 이 작품은 권속들의 표정이 다양하며 전반적으로 붉은색이 강한 반면, 권속들의 몸 부분과 내의에 흰색을 사용한 것이 눈에 확연하게 들어온다. 광배는 삼장 모두 원형 두광에 연판형 신광을 가지고 있는데, 지지보살과 지장보살의 신광은 밝은 군청을 사용한데 비해 중앙의 천장보살은 녹색 바탕에 홍색과 군청 띠를 두른 두광에 신광은 형광색을 띠고 있어 중심 보살과 좌우 보살 사이에 변화를 주고 있다. 또한 대형 화면에 자비로운 미소를 자아내고 있는 본존불을 위시한 협시상들과 엄숙한 표정의 신중들이 잘 조화를 이루고 있다.
 화기를 통해 대웅전 내에 봉안되어 있는 석가영산회상도, 제석신중도, 관음전 백의관음도 등의 제작에 관여했던 화승에 의해 제작된 것임을 알 수 있는 이 작품은 보존 상태가 양호하고 작품의 규모도 큰 편이다. 
 특히, 삼장(三藏)은 천선신(天仙神)을 이끄는 주재자로써 복을 준다고 믿었고, 불교의식집에서도 삼장신앙은 천선신에 대한 신앙으로 규정되어 있으며, 삼계(三界)의 모든 천선신을 도량(道場)으로 불러내어 예를 갖춰 공양하고 원을 빌었다. 
 범어사 대웅전 삼장보살도 역시 이와 같은 신앙의 흐름에서 제작된 것으로, 조선 후기 삼장도상과 신앙 연구에 자료적 가치가 있는 작품이다.",35.28406,129.0686,4.2
1545,1,부산광역시 금정구 범어사로 250(범어사 성보박물관) ,"범어사 권왕문 책판(梵魚寺 勸往文 冊板, 언문판)","범어사 권왕문 책판의 판수는 모두 22판이나 7, 8판이 없어지고 현재 20판만 남아 있으며, 책은 1권 1책으로 구성되어 있다. 간기에 의하면 1908년(융희 2) 음력 7월에 범어사에서 개간하였다고 한다.
 만하의 주관으로 모두 22판이 새겨진 이 책판은 현재 「권왕가(勸往歌)」 15판 중 7판과 8판을 제외한 13판, 「자책가(自責歌)」 6판, 「서왕가(西往歌)」 1판 등 20판이 남아 있다.
 범어사 권왕문 책판은 조선 말기 건봉사(乾鳳寺)의 축전(竺典)이 엮은 언문(한글) 불교 가사인 「권왕가」, 「자책가」, 「서왕가」 등 3편을 모아 판각한 것이다.
 이 3편의 불교 가사들은 대체로 몽매한 중생들을 깨우쳐 불심(佛心)을 일으키고자 하는 내용을 담고 있는데, 「권왕가」는 서방정토(西方淨土)에 왕생(往生)하는 방법을 노래하고 있고, 「자책가」는 불법(佛法)을 모르고 덧없이 세월을 보낸 것을 자책하는 내용을 담고 있으며, 「서왕가」는 출가？수도(出家？修道)하여 서방정토에 왕생할 뜻을 나타내는 내용을 담고 있다.
 불교 음악 가운데 화청(和請)에 속하는 이들 작품은 일반 민요풍을 지니고 있어 범패(梵唄)와는 달리 누구나 쉽게 부를 수 있도록 되어 있다.
 범어사 권왕문 책판은 언문(한글)으로 되어 있어 국어사 연구뿐 아니라, 한말 사찰의 불교 대중화 과정을 살피는데 중요한 자료로 평가된다.",35.28379,129.0684,3
1546,1,부산광역시 금정구 범어사로 250(범어사 성보박물관) ,범어사 선문촬요 책판(梵魚寺 禪門撮要 冊板),"범어사 선문촬요 책판은 한말의 승려 경허(鏡虛, 1849～1912)가 중국의 선종(禪宗)과 관련된 중요한 글들을 뽑아 선학(禪學)의 지침서로 활용했던 선문촬요를 판각한 것이다. 원래 선문촬요는 상？하 2권 2책으로 구성되어 있는데, 책판의 수는 모두 118판으로 빠진 부분이 없이 온전하게 잘 보존되어 있다.
 간기(刊記)에 의하면 1907년(융희 1) 경북 청도군 운문사(雲門寺)에서 상편을 처음으로 판각했으나, 하편을 범어사에서 간행하게 되면서 책판을 모두 범어사로 옮겨와 보관하였는데, 이 책의 전체 간행은 1908년(융희 2)에 이루어졌다고 한다.
 78번째 판과 118번째 판에 판각되어 있는 시주질(施主秩)에는 이 책판의 판각사업에 참여한 도감(都監)？간사(幹事)？교정(校正)？서사(書寫)？각수(刻手)？목수(木手) 등의 명단이 새겨져 있을 뿐 아니라, 중앙 관료나 대지주 등과 같은 대시주자(大施主者)들의 지원과 범어사 술오갑계원(戌午甲？員)들의 지출경비로 간행되었음을 기록하고 있어 이 책판의 간행 경위를 상세히 알 수 있다.
 이 책판의 구성을 보면 전반부에는 달마대사(達摩大師)？홍인대사(弘忍大師) 등 중국 역대 선사(禪師)들의 저술을 실어 상권으로 엮었으며, 후반부에는 지눌(知訥) 등 우리나라 고승(高僧)들의 저술을 실어 하권으로 엮었다. 
 범어사 선문촬요 책판은 제작연대는 그리 오래되지 않았으나, 제작에 참여한 사람들의 직책과 시주자가 기록되어 있을 뿐 아니라, 118판 모두 온전하게 보존되어 있어 한말 사찰의 목판 제작 과정을 알 수 있는 좋은 자료이다.",35.28379,129.0684,3
1547,1,부산광역시 금정구 범어사로 250(범어사 성보박물관),범어사 목제어피인통(梵魚寺 木製魚皮印筒),"범어사 목제어피인통은 사찰에서 사용하던 각종 인장(印章, 도장)을 보관하는 통이다. 인장통 표면에 붙인 어피가 훼손？탈락되고 있으나, 전체적인 형태는 양호하게 유지하고 있다. 현재 범어사성보박물관에 보관되어 있다.
 정사각형에 가까운 몸체와 우진각 형태의 뚜껑 등 인통의 기본 골격은 목재로 만들고, 그 표면을 물고기 껍질(魚皮)로 감싼 후 각 모서리마다 황동 장석(黃銅 匠錫)으로 마감한 조선시대 작품이다.
 정면에는 선각 당초문(線刻 唐草文)으로 채워진 보상화형(寶相華形)의 앞바탕에 배목과 고리가 있으며, 특히, 앞바탕 좌우 공간에 「신인(信印)」이라고 선각(線刻)된 두 글자가 부착되어 있다.
 또한 몸체 아래쪽 2군데에는 보상화형 감잡이를 붙였고 좌？우 측면에는 위쪽에 활모양의 손걸이가 있으며, 아래쪽에는 ㄷ자형 손걸이가 있다. 그리고 뒷면에는 경첩 2개가 부착되어 있다.
 뚜껑의 각 면이 만나는 4모서리는 가장자리에 연주문(聯珠文)이 새겨진 띠 모양의 금속판으로 고정을 시켰고, 꼭지에는 3장의 화판(花瓣)을 끼운 후 13각으로 이루어진 보주형(寶珠形) 손잡이로 마무리하였다.
 범어사 목제어피인통은 표면을 감싼 어피의 훼손이 있기는 하지만, 활달한 선각당초문의 장석과 함께 나름대로 인통의 원형을 남기고 있어 조선 후기의 정교한 불교공예 진수를 보여주는 귀중한 자료이다.
 아울러 오랜 역사를 지닌 큰 사찰에서 조선 후기에 제작하여 사용하다가 간혹 전해지는 불교공예품으로, 지금까지 남아 있는 사례가 드물어 조선 후기 사찰 불교공예품 연구에 자료적 가치가 있는 유물이다.",35.28406,129.0686,4.5
1548,1,부산광역시 금정구 범어사로 250 (범어사 경내),범어사 팔상·독성·나한전(梵魚寺 捌相·獨聖·羅漢殿),"정면 7칸, 측면 1칸 규모에 겹처, 맞배지붕인 본 건물은 현재 범어사 대웅전 서쪽 상단에 위치하고 있는 부속 불전(佛殿)의 하나로, 적어도 1706년 이래로 지금의 위치에서 변함없이 존속해 온 건물이다.

1902년에 조사된 일본인 학자 세키노 타다시((關野貞)의 자료에 의하면 당시까지는 중앙의 천태문(天台門)을 중심으로 좌우에 각각 팔상전과 나한전이란 별개의 건물이 서 있다가, 1905년 11월～1906년 11월까지 약 1년에 걸친 공사 끝에 현재의 모습으로 새롭게 단장되었다.
 
따라서 오른쪽의 팔상전 부분과 왼쪽의 나한전 부분의 건축 형식은 변형되거나 고쳐지지 않고 1906년 중건 이전의 모습을 그대로 유지하고 있다고 보여 지며, 다만, 팔상전과 나한전의 노후화 된 부재의 교체와 내부 가구(架構)가 수리되었을 것으로 추정된다.

또한 1906년에 단장된 독성전(獨聖殿) 부분은 문틀을 하나의 통재(通材)를 사용해서 반원형으로 구부려 만든 독특한 모습이고, 창방 사이의 삼각형 벽체 부분에는 통판(通板)으로 넝쿨 형상을 초각하였다. 창호도 팔상전과 나한전이 교살창인데 비해 독성전은 화문살로 아름답게 꾸미는 등 장식수법이 유사한 예를 찾기 어려울 정도로 뛰어나다.

이처럼 범어사 팔상？독성？나한전은 1906년에 중건된 건물임에도 불구하고, 간살, 가구(架構)와 평면, 입면 구성 등에서 1706년 이래의 건축 형식을 상당 부분 유지하고 있고, 특히 하나의 건물에 세 불전(佛殿)을 모신 점, 중앙에 위치한 독성전 개구부(開口部), 출입구의 뛰어난 의장과 초각수법은 그 예가 극히 드문 만큼 문화재로서의 가치를 충분히 갖추고 있는 건물로 평가된다.",35.28368,129.0688,4.5
1549,1,부산광역시 금정구 범어사로 248 (내원암),범어사 내원암 석조보살좌상 (梵魚寺 內院庵 石造菩薩坐像),"범어사의 산내 암자인 내원암에 모셔진 석조보살상은 좌상으로 몸체를 전체적으로 앞쪽으로 약간 기울였다. 얼굴은 약간 아래를 향해 있으며 전체적으로 갸름한 편이다. 
보살좌상의 바닥 중앙 부에 복장공이 있으나, 복장물은 이미 존재하지 않는 채 안쪽이 텅 비어 있다. 
수인은 두 손 모두 땅을 향해 아래로 늘어뜨려져 있다. 얼굴은 약간 아래를 향해 있으며 전체적으로 갸름한 편이다. 
눈, 코, 입이 작은 편이며 머리에 두건을 쓰고 있다. 두건과 수인을 통해 이 보살상은 지장보살상으로 추정할 수도 있으나, 정확한 도상은 좀 더 연구가 필요할 것으로 판단된다. 전체적으로 조각 기법과 수준이 그렇게 뛰어나지는 못한 편이다. 
또한 18세기 보살상에서 확인되는 도식적이고 편평한 느낌의 조각처리 기법이 이 보살상에서는 더욱 강하게 느껴져 조성시기가 다소 늦은 것으로 판단된다. 
고려 말의 지장보살상을 비롯하여 조선시대 15∼16세기 지장보살상은 고려시대의 요소를 계승한 점이 많아 두건을 머리에 쓰고 석장을 쥐고 있는 예가 있다. 그러나 17세기대로 넘어오면 지장보살상에서 두건을 확인하기 쉽지 않으며, 일반적으로 조선 후기의 지장보살상 혹은 나한상은 승려형을 이룬 예가 보편적이다.
따라서 내원암 석조보살좌상은 시대가 다소 늦은 편에 속하지만 조선 후기에는 그 예를 흔히 찾아볼 수 없는 두건형 보살상으로써 그 중요성이 인정되는 문화재이다.",35.28406,129.0686,4.5
1550,1,부산광역시 금정구 범어사로 ,범어사와 영화,"최근 부산영상위원회에서 마련한 '프로덕션&로케이션 디렉터리' 속의 사진 자료를 보면 부산이 이렇게 아름다운 곳이구나, 라는 사실이 새삼스럽다. 온통 빼어난 영화 장면이다.

자료에는 금정산 범어사 사천왕문의 모습도 들어 있다.
다문천왕 지국천왕 증장천왕 광목천왕이 앉아 있는 사이로 나 있는 길의 저 안쪽은 고즈넉하고 적요하다.
알음알이와 분별이 없다는 곳, 그곳이다. 사천왕의 모습은 제 각각으로 위엄 있고 무서우며,사천왕이 깔고 앉아 있는 악귀의 모습은 제 각각으로 험상궂고 애처롭고 익살맞다.
그 중 최고 엄살을 부리고 있는 악귀는 탑을 들고 있는 광목천왕이 깔고 앉은 악귀다.
그 악귀는 위로 쳐다보며 메롱 하고 혀를 내밀고 있다. 그런 익살과 재미를 새길 줄 알았던 이는 누구 였을까.

자료의 로케이션 갤러리를 보니까 부산의 온갖 곳이 멋지게 들어 있다.
부전동에는 연탄공장이 있고, 동아대에는 터널 같은 벙커가 있다.
광안대교 부두 누리마루 자갈치시장 신평공단 등의 이미지가 모두 영화 장면이다.
그 장면들 속에 부산 사람들이 살고 있다.",35.28368,129.0688,4.5
1551,1,부산광역시 금정구 범어사로 ,범어사 템플스테이-템플라이프,"부산의 도심사찰 범어사는 자연을 그리워하는 부산지역 사람들이 자주 찾고 있으며,
특히 항구도시 부산을 방문하는 외국인들에게 아름다운 전통문화 체험장으로 각광받고 있다.
범어사 템플 스테이의 가장 큰 특징으로는 불무도와의 만남을 꼽을 수 있다.

휴휴정사 앞 넓은 잔디밭에서 금정산의 정기를 마시며 수련하는 불무도는 일상에서 움츠러든
몸과 마음의 긴장을 풀고 호연지기를 기르는 체험수련법으로 손색이 없다.

저녁에는 직접 만든 작은 컵등(燈)에 불을 밝히고 탑돌이를 하며 기원하는 시간이 마련되어 있다.
템플스테이 전용공간인 휴휴정사는 얼마전까지 스님들이 수행하던 ‘평생선원’이었다.

한번 평생선원에 들어가면 견성성불하기 전에는 결코 밖을 나가지 않겠다는 굳은 서원(誓願)과
결의가 서려있는 곳이다.

이러한 수행자의 향기가 머무는 곳에 머무는 것만으로도 세상에 온갖 번뇌에 시달려 사는 사람들에게는
신선한 충격을 줄 것이다. 범어사는 지금도 참선수행도량으로 많은 선승들이 수행정진하고 있다.

<템플스테이>
☞정기참선(매월 넷째주 토,일) 그 외 상시예약운영
☞ 프로그램 : 참선, 새벽·저녁예불, 108배서원주만들기, 암자순례, 주지스님과의 대화
☞ 수용인원 : 40명
※1달 전 예약, 10명이상 단체 문의(정기참선 참여는 별도 문의)

<템플라이프>
☞ 비        용 : 20,000~30,000원
☞ 운영시간 : 2~5시간
☞ 프로그램 : 발우공양(절밥체험), 사찰안내, 다도 등
※ 만들기체험(염주, 연꽃만들기 등) 추가 가능
※  일주일전 예약, 15명이",35.28406,129.0686,4.5
1552,1,부산광역시 금정구 범어사로,범어사,"범어사는 합천 해인사, 양산 통도사와 더불어 남도 3대 사찰로 한국 불교계의 중심지 중 하나다.

금정산 동쪽 기슭에 위치하며 신라 제30대 문무왕 18년(678년) 의상대사가 창건, 흥덕왕 때 중건했다. '범어사'라는 절 이름의 유래를 (동국여지승람(東國與地勝覽))은 다음과 같이 기록하고 있다. “지금의 금정산 정상에는 항상 마르지 않는 금빛 웅덩이가 있어 한 마리의 금빛 나는 물고기가 오색 구름을 타고 하늘(梵天)에서 내려와 그 속에서 놀았다고 한다. 그래서 그 산을 ‘금샘(金井)’이라는 뜻의 금정산으로 짓고, 그 속의 절을 '하늘 나라의 고기(梵魚)'라는 뜻의 범어사라고 지었다.”

범어사의 대표적 건물로는 대웅전을 꼽을 수 있다. 가늘고 섬세한 조각과 장식이 우리나라 목조건물의 진수를 보여준다. 범어사 경내에는 등나무 줄기가 서로 얽혀 등나무 군생지를 이루고 있다. 4월~5월경이면 등나무 줄기마다 꽃이 만발해 화사함을 더한다. 이외 일주문, 당간지주, 석등 그리고 7개동의 전각, 누각, 3개의 문, 10동의 암자가 자리를 지키고 있다.
절 행사로 음력3월 보름 스님들의 추모제와 단옷날 고당제가 있다",35.28368,129.0688,4.5
1553,1,부산광역시 금정구 범어사로,범어사 조계문(일주문),"범어사에서 가장 처음 지나는 범어사 일주문. 시주들이 들어올 때 접하는 문으로 처음 합장을 여기서 행한다.
절 입구에 세워져 속세와 불계를 구분짓는 경계 구실을 한다. 모든 법이 하나로 통한다는 법리가 담겨 있어 삼해탈문(三解脫門)이라고도 부른다.

일반적으로 건물을 지을 때 건물의 안정을 위해 네 귀퉁이에 기둥을 세우지만, 범어사 일주문인 조계문은 기둥이 일렬로 나란히 늘어선 것이 특징이다. 다른 일주문과 달리 범어사 일주문은 일렬로 된 4개의 높은 초석(건물 기둥을 받치기 위해 놓은 받침돌) 위에 짧은 기둥을 세워 지탱케 하는 역학적인 구조를 지니고 있다. 이렇게 삼문으로 처리하고 높은 주초석 위에 짧은 기둥을 세운 점 등은 특이한 수법이다.

정면 3칸 규모의 맞배지붕, 겹처마, 다포양식의 건물로 기둥과 기둥 사이에 공포가 각 일구씩 배치된 다포계 양식의 맞배집으로서 옛 목조건물의 건축공법을 연구하는데 좋은 자료가 된다",35.28406,129.0686,3
1554,1,부산광역시 금정구 범어사로,범어사 팔상전,"팔상전은 현재 범어사 대웅전 서쪽 상단에 위치하고 있는 부속 불전의 하나로 적어도 1706년 이래 존속했던 위치에 변함없이 자리하고 있는 건물이다.
팔상전은 1906년에 중건된 건물임에도 불구하고, 1876년 이래의 간살, 가구와 평면, 입면 구성의 전레를 상당 부분 유지하고 있어 문화재로서의 가치를 충분히 갖추고 있다.
팔상전은 석가모니의 생애를 8개로 나누어 그린 팔상도와 불상을 봉인하고 있다.
팔상전에는 목조석가모니삼존불상과 팔상탱화를, 독성전에는 나반존자를, 나한전에는 소조석가모니삼존불상과 16나한상을 모시고 있다",35.28406,129.0686,4.5
1555,1,부산광역시 금정구 범어사로,범어사 관음전,"""본래 관음전은 대웅전 왼쪽에 있었으나 1938년에 대웅전 오른쪽에 있던 금어선원을 지금의 자리로 옮기면서 이곳으로 이전해 건립했다. 대웅전을 가운데 두고 왼쪽의 지장전과 오른쪽의 관음전이 협시하는 구조이다.

관음전이 처음 건립된 것은 1613년(광해군5)이다. 이 해에 여러 전각이 들어섰고 백 여 년이 지난 1721년(경종 1)에 한 차례의 중건이 있었다. 크기는 앞면 5칸, 옆면 3칸의 겹처마 맞배지붕 건물이다. 기둥 위에만 공포대를 올린 주심포식으로 3개의 기둥에는 용두를 조각하여 익공을 받치게 하였다. 소규모의 건물이면서도 장식과 조각이 매우 돋보이며, 특히 청기와 지붕과 화려한 단청이 돋보인다.
내부에는 목조 관음보살좌상을, 뒷벽에는 관음보살탱을 봉안하였다.

범어사의 백의 관음보살도는 크기가 2미터를 넘는 방형에 가까운 비교적 큰 작품으로 비단 7폭을 연결하여 한 화폭을 이루고 있다. 전체적으로 화면의 채색이 밝고 화려하며 백색 안료와 금분이 눈에 두드러지며, 화풍상 필선의 섬세함이 돋보이는 작품이다. 화면 하단 좌우 양측에 있는 화기의 내용으로 보아 이 백의관음보살도는 숭정 기원후 5번째 임오 즉, 1882년에 조성된 것임을 알 수 있다.",35.28406,129.0686,4.5
1556,2,부산광역시 금정구 무학송로,범일돼지국밥,"금정구청앞 영풍주유소 오른편에 있는 범일돼지국밥은 24시간 사골을 푹 고아 우러나온 국물이 담백하고 시원하다.

국물을 끓일 때 들어가는 각종 재료 또한, 영양이 풍부한 것으로 20년 전통의 국밥집 명성에 어울리게 돼지 수육과 내장 수육은 이 집의 큰 자랑이다. 또한 음식마다 나오는 찬은 싱싱한 야채를 비롯해 깔끔한 맛을 자랑한다.

돼지국밥 1인분 4천원
내장국밥 1인분 4천원
수육백반 1인분 6천원
수육     1인분 1만 5천",35.24275,129.0937,4.2
1557,2,부산광역시 금정구 무학송로,범일돼지국밥,"금정구청앞 영풍주유소 오른편에 있는 범일돼지국밥은 24시간 사골을 푹 고아 우러나온 국물이 담백하고 시원하다.

국물을 끓일 때 들어가는 각종 재료 또한, 영양이 풍부한 것으로 20년 전통의 국밥집 명성에 어울리게 돼지 수육과 내장 수육은 이 집의 큰 자랑이다. 또한 음식마다 나오는 찬은 싱싱한 야채를 비롯해 깔끔한 맛을 자랑한다.

돼지국밥 1인분 4천원
내장국밥 1인분 4천원
수육백반 1인분 6천원
수육     1인분 1만 5천",35.24275,129.0937,4.2
1558,1,부산광역시 금정구 두구로,홍법사,"맑은 물 흐르는 냇가를 따라 길을 달리면
앞엔 금정산, 뒤엔 철마산이 연잎처럼 둘러진 가운데 홍법사가 있습니다.

도심의 근교에 자리한 지리적 여건과 1만 5천 평의 숲으로 둘러진 자연환경은
바쁘고 지친 현대인들의 심신을 부처님 품안으로 인도하는 생활 속의 수행도량입니다.

입구인 석주를 지나면 먼저 홍법사의 마스코트인 천진삼존불이 미소로 반깁니다.
그리고 경내 숲길을 천천히 걷다보면 관세음보살상, 넓은 잔디마당, 독성각,
포대화상과 연못, 생태체험학습장 등을 숨바꼭질 하듯 만날 수 있습니다",35.30379,129.1104,4.5
1559,1,부산광역시 금정구 노포동 ,노포동 고분군(老圃洞 古墳群),"노포동 고분군은 1983년 발견된 토기 3점이 부산시에 신고 되어 알려진 후 여러 차례에 걸친 조사 결과 삼한시대(三韓時代) 또는 삼국시대 초기 유적임이 밝혀졌다.
 1984년부터 1986년까지 2차에 걸쳐 부산박물관과 부산대학교박물관에서 발굴조사를 실시하였는데, 조사된 유구(遺構)는 무문토기시대 주거지 2동, 삼한시대 토광묘 45기, 옹관묘 6기이고, 출토 유물은 토기류 134점, 철기류 263점, 구슬류 433점, 석기류 4점 등 총834점이다.
 확인된 묘제(墓制)는 목곽묘(木槨墓), 목관묘(木棺墓), 토광묘(土壙墓), 옹관묘(甕棺墓)의 네 종류인데, 옹관묘는 목곽묘의 부묘적(副墓的)인 성격을 가지고 있다. 출토 유물 중 토기류는 회색의 와질토기(瓦質土器)가 주류를 이루는데, 이 유물들은 이 지역의 도질토기(陶質土器) 발생시기를 알려주는 자료이다.
 노포동 고분군은 3세기 중엽～4세기 초에 걸쳐 조성된 분묘유적(墳墓遺蹟)으로 무문토기시대의 주거유적을 파괴하고 조성되었다. 목곽묘를 주축으로 하는 묘제와 출토된 다량의 와질토기, 철제무기류, 농공구류(農工具類) 등은 당시 부산 지역의 사회 동향 및 외래문화의 수용 과정을 파악할 수 있는 매우 중요한 자료이다.
 노포동 고분군은 묘제와 출토 유물에 의해 크게 전？후기로 나누어지는데, 후기에 보이는 변화는 환두대도(環頭大刀)의 출현, 철제 창의 의기화(儀器化)와 다양화, 쇠 화살촉의 관통력 증대와 숫적 증가 및 세장화(細長化), 부곽(副槨)이 딸린 대형 목곽묘의 등장, 단조(鍛造) 기술의 발달, 토기 기종의 다양화, 도질토기의 출현 등이다. 
 이러한 상황은 사회의 전반적인 성장 및 변화와 함께 새로운 지배계층이 출현하였음을 의미하는데, 그 시기는 전기가 3세기 중엽이고, 후기가 3세기 후반～4세기 초이다.",35.28324,129.0986,2
1560,2,부산광역시 금정구 금정로 ,참나무 숯불구이,"꽃살이 맛있는 집.

먹음직스러운 선홍빛 꽃살에 선명한 마블링이 보기 좋게 퍼져 있다.

입안에서 사르르르 녹아 내리는 맛이 일품.

고기를 다 먹은 뒤 후식으로는 개운하게 속을 가라앉혀주는 물 국수도 좋다",35.22704,129.0857,4.1
1561,2,부산광역시 금정구 금정로 ,참나무 숯불구이,"꽃살이 맛있는 집.

먹음직스러운 선홍빛 꽃살에 선명한 마블링이 보기 좋게 퍼져 있다.

입안에서 사르르르 녹아 내리는 맛이 일품.

고기를 다 먹은 뒤 후식으로는 개운하게 속을 가라앉혀주는 물 국수도 좋다",35.22704,129.0857,4.1
